Date,hourly_interval,actual_oa_cfm,outdoor_temp,supply_temp,cooling_baseline,cooling_savings,fan_savings,Cooling/Heating Baseline,Cooling + Heating savings,baseline (20% OA),savings (20% OA),Total Energy Savings (kWh),Total Energy Saved (%)
10/24/2025,2025-10-24 00:00:00.000 -0700,774.4041931,57.15645663,62.925597,-110282.8873,-105457.8291,14.99374417,110282.8873,105457.8291,6.464413091,6.181584356,21.2,27.6%
10/24/2025,2025-10-24 01:00:00.000 -0700,787.8610097,55.93484459,64.21759586,-158333.0734,-151285.364,14.99367756,158333.0734,151285.364,9.28095389,8.867840799,23.9,27.5%
10/24/2025,2025-10-24 02:00:00.000 -0700,793.5031942,55.63855476,64.43196869,-168094.9006,-160559.0904,14.99364895,168094.9006,160559.0904,9.853159472,9.411435545,24.4,27.5%
10/24/2025,2025-10-24 03:00:00.000 -0700,819.5253103,54.64130007,63.0107542,-159990.4851,-152582.7873,14.99351162,159990.4851,152582.7873,9.378105811,8.9438914,23.9,27.5%
10/24/2025,2025-10-24 04:00:00.000 -0700,808.8143514,54.72287801,59.22143892,-85994.49027,-82064.9096,14.99356922,85994.49027,82064.9096,5.040708691,4.810369847,19.8,27.7%
10/24/2025,2025-10-24 05:00:00.000 -0700,833.3373464,54.46989295,58.96416601,-85912.52379,-81867.65856,14.99343509,85912.52379,81867.65856,5.035904091,4.798807653,19.8,27.7%
10/24/2025,2025-10-24 06:00:00.000 -0700,2174.010451,55.57271773,58.93287722,-64232.80886,-56343.38526,14.96721493,64232.80886,56343.38526,3.765111891,3.302660332,18.3,27.3%
10/24/2025,2025-10-24 07:00:00.000 -0700,2334.620565,57.88067767,59.07928721,-22912.62002,-19890.45765,14.96059072,22912.62002,19890.45765,1.343060963,1.165911938,16.1,27.6%
10/24/2025,2025-10-24 08:00:00.000 -0700,2059.149895,59.67236977,59.12848778,10396.84809,9187.31879,14.9713903,10396.84809,9187.31879,0.6094283759,0.5385298236,15.5,27.8%
10/24/2025,2025-10-24 09:00:00.000 -0700,2363.717338,62.14103228,59.09306602,58264.92298,50484.02984,14.95928807,58264.92298,50484.02984,3.41529443,2.959204563,17.9,27.3%
10/24/2025,2025-10-24 10:00:00.000 -0700,2358.578084,68.54343414,59.13113454,179925.5192,155949.9041,14.9595205,179925.5192,155949.9041,10.54663067,9.1412605,24.1,26.4%
10/24/2025,2025-10-24 11:00:00.000 -0700,2371.776754,75.44763641,59.77632008,299572.8831,259430.5102,14.95892153,299572.8831,259430.5102,17.55995798,15.20694667,30.2,25.9%
10/24/2025,2025-10-24 12:00:00.000 -0700,2334.355094,76.3977253,60.20468299,309546.1968,268721.8611,14.96060246,309546.1968,268721.8611,18.14456019,15.75157451,30.7,25.9%
10/24/2025,2025-10-24 13:00:00.000 -0700,2346.628522,76.434478,58.81075191,336895.1478,292230.3024,14.96005704,336895.1478,292230.3024,19.747664,17.12956052,32.1,25.9%
10/24/2025,2025-10-24 14:00:00.000 -0700,2325.467271,74.08516719,58.57472165,296497.6768,257543.1207,14.96099386,296497.6768,257543.1207,17.37969969,15.09631422,30.1,26.0%
10/24/2025,2025-10-24 15:00:00.000 -0700,2317.679974,70.52916209,58.58912303,228245.7867,198358.7421,14.96133434,228245.7867,198358.7421,13.37900274,11.62712439,26.6,26.2%
10/24/2025,2025-10-24 16:00:00.000 -0700,2343.778339,66.56725019,58.64751434,151393.6704,131346.5967,14.96018421,151393.6704,131346.5967,8.874189356,7.699097108,22.7,26.6%
10/24/2025,2025-10-24 17:00:00.000 -0700,2337.778255,63.48767732,58.81666997,89290.97645,77497.61469,14.96045091,89290.97645,77497.61469,5.233937658,4.542650333,19.5,27.0%
10/24/2025,2025-10-24 18:00:00.000 -0700,2342.657776,61.99644051,58.65033728,63964.10921,55498.2325,14.96023412,63964.10921,55498.2325,3.749361619,3.253120311,18.2,27.2%
10/24/2025,2025-10-24 19:00:00.000 -0700,2343.38656,61.69066245,58.99137967,51599.4895,44767.98948,14.96020166,51599.4895,44767.98948,3.024589068,2.624149442,17.6,27.3%
10/24/2025,2025-10-24 20:00:00.000 -0700,555.0796712,61.42754281,58.96235421,47124.54525,45646.69909,14.99453752,47124.54525,45646.69909,2.76228284,2.675656453,17.7,27.9%
10/24/2025,2025-10-24 21:00:00.000 -0700,629.4310669,61.01852328,58.90002238,40497.26321,39057.13691,14.99432567,40497.26321,39057.13691,2.373813787,2.289398412,17.3,27.9%
10/24/2025,2025-10-24 22:00:00.000 -0700,615.1584997,60.79946162,60.58481318,4103.219531,3960.613296,14.99437051,4103.219531,3960.613296,0.2405169714,0.232157872,15.2,28.0%
10/24/2025,2025-10-24 23:00:00.000 -0700,636.1357152,60.8855526,59.34792608,29393.26857,28336.87829,14.99430389,29393.26857,28336.87829,1.722934852,1.661012796,16.7,27.9%
10/25/2025,2025-10-25 00:00:00.000 -0700,687.312177,60.70633831,59.21249129,28556.37964,27447.50126,14.99412201,28556.37964,27447.50126,1.673879229,1.608880496,16.6,27.9%
10/25/2025,2025-10-25 01:00:00.000 -0700,683.825648,60.745707,61.67803879,-17822.45439,-17133.89782,14.99413531,17822.45439,17133.89782,1.04469252,1.004331642,16.0,27.9%
10/25/2025,2025-10-25 02:00:00.000 -0700,704.896725,60.19756622,59.54710369,12434.24176,11939.05214,14.99405288,12434.24176,11939.05214,0.7288535617,0.6998272064,15.7,27.9%
10/25/2025,2025-10-25 03:00:00.000 -0700,714.6284271,59.77156048,59.10595779,12723.66091,12209.94962,14.99401311,12723.66091,12209.94962,0.7458183416,0.7157063084,15.7,27.9%
10/25/2025,2025-10-25 04:00:00.000 -0700,695.5343058,59.65545623,61.72903188,-39638.47223,-38080.84979,14.99409012,39638.47223,38080.84979,2.32347434,2.232171734,17.2,27.9%
10/25/2025,2025-10-25 05:00:00.000 -0700,689.6824931,59.29823914,63.42943776,-78971.99299,-75894.84039,14.9941129,78971.99299,75894.84039,4.629073446,4.448701078,19.4,27.7%
10/25/2025,2025-10-25 06:00:00.000 -0700,723.4100306,58.97553654,63.49648228,-86422.39876,-82890.26147,14.99397628,86422.39876,82890.26147,5.065791252,4.858749207,19.9,27.7%
10/25/2025,2025-10-25 07:00:00.000 -0700,716.5277715,59.52488302,59.46142267,1213.108051,1163.99926,14.99400522,1213.108051,1163.99926,0.07110832657,0.06822973387,15.1,28.0%
10/25/2025,2025-10-25 08:00:00.000 -0700,662.1632222,60.87950993,59.21601645,31799.34126,30609.71672,14.99421491,31799.34126,30609.71672,1.863970765,1.794238964,16.8,27.9%
10/25/2025,2025-10-25 09:00:00.000 -0700,631.6393794,62.15432803,61.72709688,8166.950718,7875.506216,14.99431855,8166.950718,7875.506216,0.4787192683,0.4616357688,15.5,28.0%
10/25/2025,2025-10-25 10:00:00.000 -0700,511.7078715,66.218964,63.3793883,54281.32916,52712.05326,14.99463768,54281.32916,52712.05326,3.181789517,3.089803825,18.1,27.9%
10/25/2025,2025-10-25 11:00:00.000 -0700,454.2799449,70.25903447,63.36189836,131845.654,128461.7649,14.99474649,131845.654,128461.7649,7.728350175,7.529997944,22.5,27.8%
10/25/2025,2025-10-25 12:00:00.000 -0700,521.7413864,71.42041715,59.42496611,229305.042,222545.8369,14.99461595,229305.042,222545.8369,13.44109273,13.04489079,28.0,27.6%
10/25/2025,2025-10-25 13:00:00.000 -0700,570.5778097,75.84920006,59.29420191,316465.3445,306263.7568,14.99449769,316465.3445,306263.7568,18.55013743,17.95215456,32.9,27.5%
10/25/2025,2025-10-25 14:00:00.000 -0700,564.8336034,72.52475599,62.76374385,186591.5081,180637.0926,14.99451271,186591.5081,180637.0926,10.93736859,10.58834072,25.6,27.6%
10/25/2025,2025-10-25 15:00:00.000 -0700,565.8209157,67.66366806,64.8522302,53743.44615,52025.41418,14.99451015,53743.44615,52025.41418,3.150260619,3.049555345,18.0,27.8%
10/25/2025,2025-10-25 16:00:00.000 -0700,547.3549281,66.21636378,65.83522555,7285.838393,7060.531073,14.99455656,7285.838393,7060.531073,0.4270714181,0.4138646585,15.4,28.0%
10/25/2025,2025-10-25 17:00:00.000 -0700,528.2732193,63.33828316,66.37076238,-57968.87282,-56238.73705,14.99460134,57968.87282,56238.73705,3.397940962,3.296526205,18.3,27.8%
10/25/2025,2025-10-25 18:00:00.000 -0700,616.1376953,60.4213871,66.77905273,-121533.1363,-117302.563,14.9943675,121533.1363,117302.563,7.123864963,6.875882943,21.9,27.7%
10/25/2025,2025-10-25 19:00:00.000 -0700,711.5274933,59.29240704,67.00796712,-147490.6466,-141561.6268,14.9940259,147490.6466,141561.6268,8.645407187,8.297867927,23.3,27.6%
10/25/2025,2025-10-25 20:00:00.000 -0700,717.4844218,59.78278249,67.07763672,-139448.4334,-133795.7736,14.99400123,139448.4334,133795.7736,8.173999614,7.842659649,22.8,27.6%
10/25/2025,2025-10-25 21:00:00.000 -0700,715.3434469,59.6645785,67.07763672,-141708.0209,-135980.9077,14.99401015,141708.0209,135980.9077,8.306449055,7.97074488,23.0,27.6%
10/25/2025,2025-10-25 22:00:00.000 -0700,712.55401,59.91060117,67.07763672,-137005.0515,-131489.5996,14.99402168,137005.0515,131489.5996,8.03077676,7.707479462,22.7,27.6%
10/25/2025,2025-10-25 23:00:00.000 -0700,740.5415883,59.24727135,67.0123881,-148437.9719,-142227.5486,14.99390182,148437.9719,142227.5486,8.700936219,8.336902031,23.3,27.6%
10/26/2025,2025-10-26 00:00:00.000 -0700,759.5131816,58.02638162,62.79850705,-91223.94981,-87309.49827,14.99381523,91223.94981,87309.49827,5.347242076,5.117790051,20.1,27.7%
10/26/2025,2025-10-26 01:00:00.000 -0700,742.0994436,58.44942048,58.99482358,-10425.92564,-9988.802838,14.99389487,10425.92564,9988.802838,0.6111328043,0.5855101312,15.6,28.0%
10/26/2025,2025-10-26 02:00:00.000 -0700,753.5822001,58.24532445,59.58984585,-25701.87099,-24607.60701,14.99384277,25701.87099,24607.60701,1.506557503,1.442415417,16.4,27.9%
10/26/2025,2025-10-26 03:00:00.000 -0700,770.7675791,57.59437739,60.90374406,-63261.85329,-60507.04055,14.99376178,63261.85329,60507.04055,3.708197731,3.546719844,18.5,27.8%
10/26/2025,2025-10-26 04:00:00.000 -0700,764.8740051,57.15751247,59.20156218,-39074.05422,-37385.53849,14.99378997,39074.05422,37385.53849,2.290390048,2.191414918,17.2,27.8%
10/26/2025,2025-10-26 05:00:00.000 -0700,783.6907033,56.78550822,59.61308842,-54052.02306,-51658.79888,14.99369845,54052.02306,51658.79888,3.168348362,3.028065585,18.0,27.8%
10/26/2025,2025-10-26 06:00:00.000 -0700,757.934819,56.75013053,62.03073978,-100944.1266,-96621.58034,14.9938226,100944.1266,96621.58034,5.917006247,5.66363308,20.7,27.7%
10/26/2025,2025-10-26 07:00:00.000 -0700,766.1777893,57.07906386,62.85715357,-110453.963,-105672.7554,14.99378377,110453.963,105672.7554,6.474440971,6.194182617,21.2,27.6%
10/26/2025,2025-10-26 08:00:00.000 -0700,732.5071788,58.60875111,63.23952115,-88521.80023,-84858.36214,14.99393717,88521.80023,84858.36214,5.188851127,4.974112669,20.0,27.7%
10/26/2025,2025-10-26 09:00:00.000 -0700,651.1017995,61.60960166,63.51512426,-36425.97004,-35086.02571,14.9942536,36425.97004,35086.02571,2.135168232,2.056625188,17.1,27.9%
10/26/2025,2025-10-26 10:00:00.000 -0700,516.9702128,67.03798434,63.65628815,64644.50441,62756.40932,14.99462639,64644.50441,62756.40932,3.789244104,3.6785703,18.7,27.8%
10/26/2025,2025-10-26 11:00:00.000 -0700,426.9027262,70.8741333,63.82588132,134734.3848,131484.7534,14.99478962,134734.3848,131484.7534,7.897677891,7.707195393,22.7,27.8%
10/26/2025,2025-10-26 12:00:00.000 -0700,531.822379,73.16695328,64.1841884,171714.5334,166555.1192,14.99459325,171714.5334,166555.1192,10.06533021,9.762902651,24.8,27.7%
10/26/2025,2025-10-26 13:00:00.000 -0700,571.7790334,73.25995712,64.68836606,163854.5347,158561.3942,14.99449451,163854.5347,158561.3942,9.60460344,9.294337289,24.3,27.6%
10/26/2025,2025-10-26 14:00:00.000 -0700,567.3062185,71.65013224,65.25429993,122262.7306,118344.0635,14.99450628,122262.7306,118344.0635,7.166631334,6.936932208,21.9,27.7%
10/26/2025,2025-10-26 15:00:00.000 -0700,537.7820084,68.33418528,65.41388474,55824.46526,54128.34136,14.99457942,55824.46526,54128.34136,3.272242981,3.172821885,18.2,27.8%
10/26/2025,2025-10-26 16:00:00.000 -0700,517.3651057,66.04670652,59.06669483,133429.9034,129529.7917,14.99462553,133429.9034,129529.7917,7.821213563,7.592602095,22.6,27.7%
10/26/2025,2025-10-26 17:00:00.000 -0700,582.5993113,62.97339446,59.06771832,74660.90514,72203.42537,14.99446527,74660.90514,72203.42537,4.376371931,4.232322706,19.2,27.8%
10/26/2025,2025-10-26 18:00:00.000 -0700,678.6651647,59.80505886,62.16296673,-45073.76679,-43345.51847,14.99415473,45073.76679,43345.51847,2.642073083,2.540768961,17.5,27.8%
10/26/2025,2025-10-26 19:00:00.000 -0700,724.1820597,59.26046689,63.64882189,-83887.7942,-80455.5888,14.993973,83887.7942,80455.5888,4.917221231,4.716036858,19.7,27.7%
10/26/2025,2025-10-26 20:00:00.000 -0700,734.3748912,60.03118019,64.25009918,-80648.85543,-77302.7258,14.99392902,80648.85543,77302.7258,4.7273655,4.531226601,19.5,27.7%
10/26/2025,2025-10-26 21:00:00.000 -0700,782.6903524,59.20334619,64.5927475,-103023.7954,-98468.10441,14.99370343,103023.7954,98468.10441,6.038909462,5.77187013,20.8,27.6%
10/26/2025,2025-10-26 22:00:00.000 -0700,798.7784688,57.70794627,64.71179962,-133885.6607,-127843.5713,14.99362182,133885.6607,127843.5713,7.847928528,7.493761504,22.5,27.6%
10/26/2025,2025-10-26 23:00:00.000 -0700,824.5384013,57.0730416,64.70682386,-145927.3817,-139129.4873,14.99348414,145927.3817,139129.4873,8.553773838,8.155304064,23.1,27.5%
10/27/2025,2025-10-27 00:00:00.000 -0700,830.8353699,56.902996,64.41325378,-143566.0878,-136827.117,14.99344914,143566.0878,136827.117,8.415362709,8.020346834,23.0,27.5%
10/27/2025,2025-10-27 01:00:00.000 -0700,814.2530752,57.67811495,64.41325378,-128748.9139,-122826.0778,14.99354016,128748.9139,122826.0778,7.546829652,7.199652858,22.2,27.6%
10/27/2025,2025-10-27 02:00:00.000 -0700,754.5608348,58.60677598,64.18221614,-106580.114,-102036.5445,14.99383826,106580.114,102036.5445,6.247368931,5.981040122,21.0,27.6%
10/27/2025,2025-10-27 03:00:00.000 -0700,756.8498291,59.26318442,62.94728762,-70425.31683,-67413.93892,14.99382765,70425.31683,67413.93892,4.128095945,3.951579069,18.9,27.7%
10/27/2025,2025-10-27 04:00:00.000 -0700,743.9223836,59.49501705,59.38840624,2037.972182,1952.317204,14.99388671,2037.972182,1952.317204,0.1194590963,0.1144382886,15.1,28.0%
10/27/2025,2025-10-27 05:00:00.000 -0700,750.6015635,59.625103,58.93965352,13103.05213,12547.39273,14.99385645,13103.05213,12547.39273,0.7680569828,0.7354860917,15.7,27.9%
10/27/2025,2025-10-27 06:00:00.000 -0700,2183.078033,59.492379,58.99451523,9517.163818,8343.338323,14.96686581,9517.163818,8343.338323,0.5578642332,0.4890585183,15.5,27.8%
10/27/2025,2025-10-27 07:00:00.000 -0700,2344.21625,59.66832867,58.95782401,13582.00706,11783.18437,14.96016469,13582.00706,11783.18437,0.7961317152,0.6906907602,15.7,27.8%
10/27/2025,2025-10-27 08:00:00.000 -0700,2330.871507,60.6898606,58.95239563,33213.38034,28839.58814,14.96075622,33213.38034,28839.58814,1.946856995,1.690479961,16.7,27.5%
10/27/2025,2025-10-27 09:00:00.000 -0700,2367.4401,62.73430945,59.17455069,68048.34843,58946.63155,14.95911907,68048.34843,58946.63155,3.988766027,3.455253901,18.4,27.2%
10/27/2025,2025-10-27 10:00:00.000 -0700,2353.332937,67.39553146,59.0273852,159965.4839,138697.007,14.95975668,159965.4839,138697.007,9.376640323,8.129953515,23.1,26.5%
10/27/2025,2025-10-27 11:00:00.000 -0700,2372.098531,70.63111038,59.77285201,207566.4671,179749.0596,14.95890685,207566.4671,179749.0596,12.16685036,10.5362872,25.5,26.3%
10/27/2025,2025-10-27 12:00:00.000 -0700,2347.775922,70.44525846,59.74862188,204476.9049,177354.5346,14.96000576,204476.9049,177354.5346,11.98575058,10.39592817,25.4,26.3%
10/27/2025,2025-10-27 13:00:00.000 -0700,2321.148808,72.96050911,58.86931763,269367.2164,234042.8439,14.96118296,269367.2164,234042.8439,15.78940307,13.71880679,28.7,26.1%
10/27/2025,2025-10-27 14:00:00.000 -0700,2379.165019,71.90124652,58.52037048,255788.8262,221406.6891,14.95858332,255788.8262,221406.6891,14.99348337,12.97811777,27.9,26.1%
10/27/2025,2025-10-27 15:00:00.000 -0700,2393.734151,68.69288801,58.68164889,191374.8469,165493.4624,14.95791021,191374.8469,165493.4624,11.21775187,9.700671885,24.7,26.3%
10/27/2025,2025-10-27 16:00:00.000 -0700,2341.738149,65.71677106,58.75963294,132992.6524,115397.513,14.96027505,132992.6524,115397.513,7.795583376,6.764215298,21.7,26.7%
10/27/2025,2025-10-27 17:00:00.000 -0700,2324.618241,63.18981508,58.83503539,83245.96853,72312.9122,14.96103109,83245.96853,72312.9122,4.879599562,4.238740457,19.2,27.0%
10/27/2025,2025-10-27 18:00:00.000 -0700,2425.168754,60.36217219,58.94826336,27028.28122,23324.9963,14.95642974,27028.28122,23324.9963,1.584307223,1.367233077,16.3,27.6%
10/27/2025,2025-10-27 19:00:00.000 -0700,2323.046128,59.36716092,58.94724929,8027.030889,6973.518854,14.96109996,8027.030889,6973.518854,0.4705176371,0.4087642939,15.4,27.8%
10/27/2025,2025-10-27 20:00:00.000 -0700,616.4825612,59.42888762,58.83456828,11361.00857,10965.31006,14.99436644,11361.00857,10965.31006,0.6659442305,0.6427497104,15.6,28.0%
10/27/2025,2025-10-27 21:00:00.000 -0700,706.0734884,59.18135923,59.00718619,3329.491779,3196.674498,14.99404813,3329.491779,3196.674498,0.1951636447,0.187378341,15.2,28.0%
10/27/2025,2025-10-27 22:00:00.000 -0700,735.1000753,58.69156869,60.36196518,-31931.29924,-30605.15797,14.99392585,31931.29924,30605.15797,1.8717057,1.793971745,16.8,27.9%
10/27/2025,2025-10-27 23:00:00.000 -0700,764.9173319,57.61884581,62.63993187,-95983.08107,-91835.10806,14.99378976,95983.08107,91835.10806,5.626206393,5.383066123,20.4,27.7%
10/28/2025,2025-10-28 00:00:00.000 -0700,784.0863556,56.74525204,63.15051009,-122442.9129,-117018.8554,14.99369648,122442.9129,117018.8554,7.17719302,6.859252956,21.9,27.6%
10/28/2025,2025-10-28 01:00:00.000 -0700,818.9589803,55.7587574,64.34766502,-164185.5581,-156588.8781,14.9935147,164185.5581,156588.8781,9.624006924,9.178715009,24.2,27.5%
10/28/2025,2025-10-28 02:00:00.000 -0700,797.8996847,55.10307102,64.45269012,-178727.3188,-170670.456,14.99362636,178727.3188,170670.456,10.47639618,10.00412989,25.0,27.5%
10/28/2025,2025-10-28 03:00:00.000 -0700,829.3723206,54.86741778,63.00121797,-155485.7244,-148200.0998,14.99345732,155485.7244,148200.0998,9.114051841,8.686992953,23.7,27.5%
10/28/2025,2025-10-28 04:00:00.000 -0700,848.8694041,54.45112082,59.30158552,-92721.48308,-88274.67912,14.99334595,92721.48308,88274.67912,5.435022455,5.174365717,20.2,27.6%
10/28/2025,2025-10-28 05:00:00.000 -0700,846.1688578,53.56736768,58.93666458,-102639.4795,-97732.68118,14.99336168,102639.4795,97732.68118,6.016382154,5.728762085,20.7,27.6%
10/28/2025,2025-10-28 06:00:00.000 -0700,2007.260651,53.10708536,58.65436878,-106041.87,-94016.23875,14.97313054,106041.87,94016.23875,6.215818874,5.510916691,20.5,27.0%
10/28/2025,2025-10-28 07:00:00.000 -0700,2300.087695,53.60421155,59.55914599,-113834.5267,-99041.90558,14.96209515,113834.5267,99041.90558,6.672598284,5.80550443,20.8,26.8%
10/28/2025,2025-10-28 08:00:00.000 -0700,2357.286568,56.95724551,59.04698029,-39947.36999,-34627.17798,14.95957876,39947.36999,34627.17798,2.341580891,2.029729072,17.0,27.4%
10/28/2025,2025-10-28 09:00:00.000 -0700,2388.119417,66.77742958,59.11470801,146480.5855,126717.1318,14.95817059,146480.5855,126717.1318,8.586200794,7.427733402,22.4,26.6%
10/28/2025,2025-10-28 10:00:00.000 -0700,2355.232979,73.13268636,59.50591011,260489.4548,225827.6833,14.95967125,260489.4548,225827.6833,15.26901845,13.23726163,28.2,26.1%
10/28/2025,2025-10-28 11:00:00.000 -0700,2326.356494,77.80892537,60.01597023,340130.1305,295425.9532,14.96095483,340130.1305,295425.9532,19.93728784,17.31687885,32.3,25.9%
10/28/2025,2025-10-28 12:00:00.000 -0700,2364.990275,78.24003245,59.64479523,355466.5548,307970.7951,14.95923035,355466.5548,307970.7951,20.83625761,18.05221542,33.0,25.8%
10/28/2025,2025-10-28 13:00:00.000 -0700,2327.779116,80.38019511,58.87024282,411184.248,357108.1968,14.96089234,411184.248,357108.1968,24.10224197,20.93248516,35.9,25.7%
10/28/2025,2025-10-28 14:00:00.000 -0700,2379.741791,78.66591199,58.65350685,382557.1367,331122.8313,14.95855683,382557.1367,331122.8313,22.42421669,19.40931016,34.4,25.7%
10/28/2025,2025-10-28 15:00:00.000 -0700,2331.109784,73.95038821,58.72263972,291093.6401,252756.2824,14.96074572,291093.6401,252756.2824,17.06293318,14.81572581,29.8,26.0%
10/28/2025,2025-10-28 16:00:00.000 -0700,2359.408681,71.82726542,58.86193085,247845.3357,214807.5709,14.95948301,247845.3357,214807.5709,14.52786259,12.59129959,27.6,26.1%
10/28/2025,2025-10-28 17:00:00.000 -0700,2370.609576,68.57728017,58.72366899,188361.6314,163133.8411,14.95897477,188361.6314,163133.8411,11.04112728,9.562358801,24.5,26.4%
10/28/2025,2025-10-28 18:00:00.000 -0700,2357.695675,64.33027636,58.93875313,103064.3581,89335.86145,14.95956031,103064.3581,89335.86145,6.041287113,5.236568667,20.2,26.9%
10/28/2025,2025-10-28 19:00:00.000 -0700,2356.627305,62.17011509,58.63365014,67603.0639,58602.20366,14.95960847,67603.0639,58602.20366,3.962664941,3.435064693,18.4,27.2%
10/28/2025,2025-10-28 20:00:00.000 -0700,604.8454641,60.5530124,58.87109375,32151.55697,31052.87203,14.99440164,32151.55697,31052.87203,1.884616469,1.820215242,16.8,27.9%
10/28/2025,2025-10-28 21:00:00.000 -0700,718.3318212,59.20880051,58.79521523,7906.096239,7585.237453,14.99399769,7906.096239,7585.237453,0.4634288534,0.4446211872,15.4,28.0%
10/28/2025,2025-10-28 22:00:00.000 -0700,760.7535706,57.98474369,60.09463615,-40332.70434,-38599.18745,14.99380942,40332.70434,38599.18745,2.364167898,2.26255495,17.3,27.8%
10/28/2025,2025-10-28 23:00:00.000 -0700,792.0877146,56.25777028,60.29957155,-77263.07292,-73805.49491,14.99365616,77263.07292,73805.49491,4.528902282,4.326230651,19.3,27.7%
10/29/2025,2025-10-29 00:00:00.000 -0700,814.5590424,56.05330772,59.47631772,-65434.25915,-62422.95591,14.99353851,65434.25915,62422.95591,3.835536879,3.659024379,18.7,27.7%
10/29/2025,2025-10-29 01:00:00.000 -0700,801.05289,55.91470629,59.13427868,-61545.34571,-58759.97413,14.99361001,61545.34571,58759.97413,3.607581812,3.444312669,18.4,27.8%
10/29/2025,2025-10-29 02:00:00.000 -0700,845.5178253,56.3990579,59.47054812,-58714.60713,-55909.84741,14.99336546,58714.60713,55909.84741,3.441653407,3.277247797,18.3,27.7%
10/29/2025,2025-10-29 03:00:00.000 -0700,834.4663208,55.93871473,58.97018433,-57949.57286,-55217.54084,14.99342872,57949.57286,55217.54084,3.396809664,3.236667106,18.2,27.8%
10/29/2025,2025-10-29 04:00:00.000 -0700,853.1575907,54.91263142,59.16684125,-81323.47523,-77403.6029,14.99332075,81323.47523,77403.6029,4.766909451,4.537139678,19.5,27.7%
10/29/2025,2025-10-29 05:00:00.000 -0700,863.9776978,54.88545971,58.97778301,-78228.85226,-74410.32211,14.99325605,78228.85226,74410.32211,4.585513028,4.361683594,19.4,27.7%
10/29/2025,2025-10-29 06:00:00.000 -0700,2029.953089,54.65652714,58.82837296,-79749.00465,-70602.86124,14.97238041,79749.00465,70602.86124,4.674619264,4.138503003,19.1,27.2%
10/29/2025,2025-10-29 07:00:00.000 -0700,2353.5413,56.02657318,59.53268483,-67022.83037,-58110.9095,14.95974732,67022.83037,58110.9095,3.928653597,3.406266677,18.4,27.2%
10/29/2025,2025-10-29 08:00:00.000 -0700,2354.703534,60.66771698,58.93183905,33183.04246,28768.56633,14.95969507,33183.04246,28768.56633,1.94507869,1.686316901,16.6,27.5%
10/29/2025,2025-10-29 09:00:00.000 -0700,2406.101579,73.11891136,59.44657974,261360.2912,225831.511,14.95733235,261360.2912,225831.511,15.32006396,13.23748599,28.2,26.0%
10/29/2025,2025-10-29 10:00:00.000 -0700,2433.168571,84.88620478,59.65450986,482329.0801,416024.6757,14.95604679,482329.0801,416024.6757,28.27251349,24.38597161,39.3,25.5%
10/29/2025,2025-10-29 11:00:00.000 -0700,2452.237874,90.15857671,59.68700962,582494.4765,501793.0631,14.95512374,582494.4765,501793.0631,34.14387318,29.41342691,44.4,25.3%
10/29/2025,2025-10-29 12:00:00.000 -0700,2435.816435,87.63348935,59.53517736,537127.3321,463209.6156,14.95591948,537127.3321,463209.6156,31.48460329,27.15179458,42.1,25.4%
10/29/2025,2025-10-29 13:00:00.000 -0700,2434.70282,90.84670067,58.90419032,610613.0279,526620.8662,14.95597306,610613.0279,526620.8662,35.79208839,30.86874949,45.8,25.3%
10/29/2025,2025-10-29 14:00:00.000 -0700,2455.025431,85.70335248,58.62618993,517607.0393,445813.9069,14.95498759,517607.0393,445813.9069,30.34038918,26.13211646,41.1,25.4%
10/29/2025,2025-10-29 15:00:00.000 -0700,2436.286353,82.15802574,58.57593168,450795.3102,388746.3575,14.95589686,450795.3102,388746.3575,26.42410962,22.78700806,37.7,25.5%
10/29/2025,2025-10-29 16:00:00.000 -0700,2423.713352,78.74962705,58.93212922,378831.2884,326956.7996,14.95649914,378831.2884,326956.7996,22.20581996,19.16511135,34.1,25.7%
10/29/2025,2025-10-29 17:00:00.000 -0700,2443.724638,74.16521657,58.54768569,298544.7204,257326.5798,14.9555376,298544.7204,257326.5798,17.49969053,15.08362133,30.0,25.9%
10/29/2025,2025-10-29 18:00:00.000 -0700,2464.192145,70.23435402,58.83400046,217929.1586,187589.084,14.95453772,217929.1586,187589.084,12.77427659,10.99584314,26.0,26.2%
10/29/2025,2025-10-29 19:00:00.000 -0700,2420.205037,68.24810816,58.75911827,181391.5308,156589.0056,14.95666609,181391.5308,156589.0056,10.63256335,9.178722484,24.1,26.4%
10/29/2025,2025-10-29 20:00:00.000 -0700,554.1302287,66.4757206,58.7591259,147510.4242,142892.346,14.99453989,147510.4242,142892.346,8.646566484,8.37587022,23.4,27.7%
10/29/2025,2025-10-29 21:00:00.000 -0700,579.8803894,65.88684425,58.86982416,134137.3562,129742.8013,14.99447272,134137.3562,129742.8013,7.862682075,7.605087999,22.6,27.7%
10/29/2025,2025-10-29 22:00:00.000 -0700,631.8817474,64.70237268,61.5287571,60666.83548,58501.05774,14.99431776,60666.83548,58501.05774,3.556086488,3.429135858,18.4,27.8%
10/29/2025,2025-10-29 23:00:00.000 -0700,728.4234853,62.65246576,64.00784632,-25909.45492,-24843.1806,14.99395485,25909.45492,24843.1806,1.518725376,1.456223951,16.5,27.9%
10/30/2025,2025-10-30 00:00:00.000 -0700,735.9716736,60.97931767,66.54061152,-106309.6934,-101889.3022,14.99392202,106309.6934,101889.3022,6.231517782,5.972409275,21.0,27.7%
10/30/2025,2025-10-30 01:00:00.000 -0700,755.9315379,58.88409259,67.43069763,-163376.9021,-156399.4019,14.99383192,163376.9021,156399.4019,9.576606218,9.167608553,24.2,27.5%
10/30/2025,2025-10-30 02:00:00.000 -0700,799.2504639,57.80883617,67.57023621,-186598.923,-178172.9752,14.99361938,186598.923,178172.9752,10.93780322,10.44390242,25.4,27.5%
10/30/2025,2025-10-30 03:00:00.000 -0700,797.9238291,57.05516733,65.12983112,-154355.2732,-147396.8692,14.99362624,154355.2732,147396.8692,9.047788579,8.639910268,23.6,27.5%
10/30/2025,2025-10-30 04:00:00.000 -0700,844.3787476,56.21059729,59.27570311,-58592.56285,-55797.40382,14.99337206,58592.56285,55797.40382,3.434499581,3.27065673,18.3,27.7%
10/30/2025,2025-10-30 05:00:00.000 -0700,829.6738668,55.897509,59.13372065,-61863.42189,-58963.62164,14.99345564,61863.42189,58963.62164,3.626226371,3.456249803,18.4,27.7%
10/30/2025,2025-10-30 06:00:00.000 -0700,9301.998217,55.65212421,59.04570891,-64871.76506,-30779.27676,12.81851626,64871.76506,30779.27676,3.802565361,1.804178005,14.6,21.8%
10/30/2025,2025-10-30 07:00:00.000 -0700,11087.5835,56.0969333,58.89575303,-53502.23801,-19987.51874,11.30915234,53502.23801,19987.51874,3.136121806,1.171601333,12.5,19.3%
10/30/2025,2025-10-30 08:00:00.000 -0700,11295.33955,60.93900286,59.14328372,34326.96721,12421.04911,11.0980526,34326.96721,12421.04911,2.012131724,0.7280802526,11.8,19.5%
10/30/2025,2025-10-30 09:00:00.000 -0700,7367.404537,73.17832654,59.25670039,266125.8056,155354.2537,13.91364019,266125.8056,155354.2537,15.59940244,9.106345471,23.0,21.1%
10/30/2025,2025-10-30 10:00:00.000 -0700,2478.580029,83.05787646,59.65596244,447350.9885,384707.1904,14.95382482,447350.9885,384707.1904,26.22221503,22.55024563,37.5,25.5%
10/30/2025,2025-10-30 11:00:00.000 -0700,2439.752728,87.79502869,59.74885826,536130.5939,462230.8154,14.95572971,536130.5939,462230.8154,31.42617783,27.0944206,42.1,25.4%
10/30/2025,2025-10-30 12:00:00.000 -0700,2441.750252,86.92258441,59.81439788,518200.0937,446713.3587,14.95563317,518200.0937,446713.3587,30.37515204,26.18483932,41.1,25.4%
10/30/2025,2025-10-30 13:00:00.000 -0700,2429.450452,87.33438695,58.56112302,550029.7133,474534.2367,14.95622509,550029.7133,474534.2367,32.24089761,27.8156059,42.8,25.4%
10/30/2025,2025-10-30 14:00:00.000 -0700,2431.62302,84.39066874,58.61259944,492773.5728,425076.4224,14.95612097,492773.5728,425076.4224,28.88473463,24.91655465,39.9,25.4%
10/30/2025,2025-10-30 15:00:00.000 -0700,2426.930868,80.13434652,58.66775735,410355.3185,354089.5564,14.9563456,410355.3185,354089.5564,24.0536529,20.75554258,35.7,25.6%
10/30/2025,2025-10-30 16:00:00.000 -0700,2437.763607,78.17096876,58.68459854,372501.453,321198.0357,14.95582568,372501.453,321198.0357,21.83478623,18.82755192,33.8,25.7%
10/30/2025,2025-10-30 17:00:00.000 -0700,2424.116772,74.02389399,58.81085459,290812.4611,250984.0225,14.95647991,290812.4611,250984.0225,17.04645141,14.71184188,29.7,25.9%
10/30/2025,2025-10-30 18:00:00.000 -0700,2414.944832,69.53471044,58.7791556,205603.1862,177551.1889,14.9569155,205603.1862,177551.1889,12.05176942,10.40745539,25.4,26.3%
10/30/2025,2025-10-30 19:00:00.000 -0700,2420.289616,65.34435883,58.92782091,122658.5389,105886.2684,14.95666207,122658.5389,105886.2684,7.189832291,6.20669803,21.2,26.7%
10/30/2025,2025-10-30 20:00:00.000 -0700,534.5963847,64.15168743,59.12974205,95999.50791,93100.01695,14.99458685,95999.50791,93100.01695,5.627169279,5.457210841,20.5,27.8%
10/30/2025,2025-10-30 21:00:00.000 -0700,692.689713,61.77592335,58.85907364,55758.49903,53576.3895,14.99410124,55758.49903,53576.3895,3.268376262,3.140468318,18.1,27.8%
10/30/2025,2025-10-30 22:00:00.000 -0700,690.9345164,61.53165048,60.62881018,17258.69511,16584.9873,14.99410806,17258.69511,16584.9873,1.011646841,0.9721563482,16.0,27.9%
10/30/2025,2025-10-30 23:00:00.000 -0700,682.8227941,61.42122847,63.54941343,-40682.38359,-39112.95653,14.9941391,40682.38359,39112.95653,2.384664923,2.292670371,17.3,27.9%
10/31/2025,2025-10-31 00:00:00.000 -0700,688.6525762,61.01977285,64.92205257,-74595.97925,-71693.67907,14.99411686,74595.97925,71693.67907,4.372566193,4.202443087,19.2,27.8%
10/31/2025,2025-10-31 01:00:00.000 -0700,707.211058,60.97124481,66.22629051,-100455.4536,-96441.71306,14.99404352,100455.4536,96441.71306,5.888361876,5.653089863,20.6,27.7%
10/31/2025,2025-10-31 02:00:00.000 -0700,700.93594,60.62650566,66.3306427,-109040.2836,-104722.1902,14.99406876,109040.2836,104722.1902,6.391575829,6.13846367,21.1,27.7%
10/31/2025,2025-10-31 03:00:00.000 -0700,715.3754832,59.896532,64.55236041,-89000.81593,-85403.69719,14.99401001,89000.81593,85403.69719,5.216929422,5.006078382,20.0,27.7%
10/31/2025,2025-10-31 04:00:00.000 -0700,738.4432938,59.38486233,59.27902292,2023.226189,1938.817273,14.99391112,2023.226189,1938.817273,0.1185947356,0.1136469679,15.1,28.0%
10/31/2025,2025-10-31 05:00:00.000 -0700,742.1557541,59.32603734,58.99632435,6302.79361,6038.519342,14.99389462,6302.79361,6038.519342,0.369448629,0.3539577575,15.3,28.0%
10/31/2025,2025-10-31 06:00:00.000 -0700,2135.006404,59.46166039,58.98345877,9141.302012,8038.661428,14.96868374,9141.302012,8038.661428,0.5358324743,0.4711993803,15.4,27.8%
10/31/2025,2025-10-31 07:00:00.000 -0700,2325.899455,59.44442685,59.02009468,8111.533832,7045.623543,14.96097489,8111.533832,7045.623543,0.4754709163,0.412990829,15.4,27.8%
10/31/2025,2025-10-31 08:00:00.000 -0700,2363.72911,60.53455429,59.03021723,28756.90717,24916.59426,14.95928754,28756.90717,24916.59426,1.68563348,1.460527213,16.4,27.6%
10/31/2025,2025-10-31 09:00:00.000 -0700,2363.538932,65.04350878,58.86701717,118069.8136,102303.565,14.95929616,118069.8136,102303.565,6.920856601,5.996691967,21.0,26.8%
10/31/2025,2025-10-31 10:00:00.000 -0700,2348.803768,69.85889905,59.26349125,202541.8156,175664.3591,14.95995978,202541.8156,175664.3591,11.87232213,10.29685575,25.3,26.3%
10/31/2025,2025-10-31 11:00:00.000 -0700,2367.677301,73.18049202,60.04396718,251117.8088,217526.513,14.95910829,251117.8088,217526.513,14.71968398,12.75067485,27.7,26.1%
10/31/2025,2025-10-31 12:00:00.000 -0700,2333.375722,72.21565603,59.61438618,240885.8744,209130.0975,14.96064573,240885.8744,209130.0975,14.1199223,12.25850513,27.2,26.2%
10/31/2025,2025-10-31 13:00:00.000 -0700,2352.410506,69.90478516,58.60944405,215921.7407,187224.7592,14.95979811,215921.7407,187224.7592,12.65660848,10.97448765,25.9,26.3%
10/31/2025,2025-10-31 14:00:00.000 -0700,2361.745768,72.6388279,58.56831017,268972.0169,233082.5524,14.95937736,268972.0169,233082.5524,15.7662378,13.66251772,28.6,26.1%
10/31/2025,2025-10-31 15:00:00.000 -0700,2347.923151,69.51698875,58.61669362,208370.0417,180729.542,14.95999917,208370.0417,180729.542,12.21395321,10.59375979,25.6,26.3%
10/31/2025,2025-10-31 16:00:00.000 -0700,2351.212384,67.87894491,58.87223867,172172.1964,149301.3829,14.95985187,172172.1964,149301.3829,10.09215688,8.751546475,23.7,26.5%
10/31/2025,2025-10-31 17:00:00.000 -0700,2333.434906,64.14801401,58.61794459,105712.8069,91776.42537,14.96064312,105712.8069,91776.42537,6.196530301,5.37962634,20.3,26.9%
10/31/2025,2025-10-31 18:00:00.000 -0700,2363.582275,60.74931011,58.92793032,34817.49604,30168.11658,14.95929419,34817.49604,30168.11658,2.040884879,1.768353844,16.7,27.5%
10/31/2025,2025-10-31 19:00:00.000 -0700,2361.754476,59.44199028,58.92236118,9933.229818,8607.814565,14.95937697,9933.229818,8607.814565,0.5822526271,0.5045612289,15.5,27.8%
10/31/2025,2025-10-31 20:00:00.000 -0700,677.7103383,58.19927616,58.84167277,-12280.05358,-11809.86605,14.9941583,12280.05358,11809.86605,0.7198155673,0.6922547508,15.7,27.9%
10/31/2025,2025-10-31 21:00:00.000 -0700,719.5009654,58.12171535,59.23696982,-21319.20437,-20452.58357,14.99399279,21319.20437,20452.58357,1.249660279,1.198861874,16.2,27.9%
10/31/2025,2025-10-31 22:00:00.000 -0700,688.481986,59.09016399,60.30737712,-23268.24604,-22363.17439,14.99411752,23268.24604,22363.17439,1.363906567,1.310854302,16.3,27.9%
10/31/2025,2025-10-31 23:00:00.000 -0700,698.9473562,59.09390303,62.61995525,-67404.01425,-64742.32738,14.99407666,67404.01425,64742.32738,3.950997318,3.794978158,18.8,27.8%
11/1/2025,2025-11-01 00:00:00.000 -0700,716.0719126,58.69447645,63.44577592,-90825.8408,-87151.38692,14.99400712,90825.8408,87151.38692,5.32390626,5.108522094,20.1,27.7%
11/1/2025,2025-11-01 01:00:00.000 -0700,731.1153483,57.9695467,63.96277994,-114566.6465,-109834.3621,14.99394322,114566.6465,109834.3621,6.715512692,6.438122048,21.4,27.6%
11/1/2025,2025-11-01 02:00:00.000 -0700,729.6400909,57.34340045,64.30592397,-133095.5997,-127609.0525,14.9939496,133095.5997,127609.0525,7.801617801,7.4800148,22.5,27.6%
11/1/2025,2025-11-01 03:00:00.000 -0700,745.8475128,57.00591068,64.1962129,-137449.8171,-131657.9186,14.99387804,137449.8171,131657.9186,8.056847427,7.717345754,22.7,27.6%
11/1/2025,2025-11-01 04:00:00.000 -0700,763.1369349,57.07053013,60.27751528,-61304.72824,-58661.56991,14.99379819,61304.72824,58661.56991,3.593477622,3.438544543,18.4,27.8%
11/1/2025,2025-11-01 05:00:00.000 -0700,749.2590444,57.13414453,59.14317614,-38404.64833,-36778.94041,14.99386258,38404.64833,36778.94041,2.251151719,2.155858172,17.1,27.8%
11/1/2025,2025-11-01 06:00:00.000 -0700,761.947702,56.91447531,60.67084211,-71806.70762,-68715.58017,14.9938038,71806.70762,68715.58017,4.209068442,4.027876915,19.0,27.7%
11/1/2025,2025-11-01 07:00:00.000 -0700,751.6361674,56.54262886,62.46003036,-113117.0472,-108313.4955,14.99385172,113117.0472,108313.4955,6.630542038,6.348973947,21.3,27.6%
11/1/2025,2025-11-01 08:00:00.000 -0700,736.6746307,56.9927042,62.39029369,-103180.3207,-98885.95212,14.99391893,103180.3207,98885.95212,6.048084452,5.796362961,20.8,27.7%
11/1/2025,2025-11-01 09:00:00.000 -0700,691.2109014,58.35898202,59.39881992,-19877.54131,-19101.29424,14.99410699,19877.54131,19101.29424,1.165154825,1.119653824,16.1,27.9%
11/1/2025,2025-11-01 10:00:00.000 -0700,614.0206243,60.88015258,59.02090505,35541.3757,34308.43007,14.994374,35541.3757,34308.43007,2.083316278,2.011045139,17.0,27.9%
11/1/2025,2025-11-01 11:00:00.000 -0700,457.2105372,67.3423144,61.28074029,115873.0507,112879.9219,14.99474155,115873.0507,112879.9219,6.792089723,6.616642548,21.6,27.8%
11/1/2025,2025-11-01 12:00:00.000 -0700,582.7082682,71.5327872,63.02993418,162540.5382,157189.4808,14.99446497,162540.5382,157189.4808,9.52758137,9.213920329,24.2,27.6%
11/1/2025,2025-11-01 13:00:00.000 -0700,543.87901,73.35905507,64.17478078,175566.5874,170171.8426,14.99456496,175566.5874,170171.8426,10.2911247,9.974902851,25.0,27.6%
11/1/2025,2025-11-01 14:00:00.000 -0700,519.9734528,72.27388153,65.05573718,137982.0475,133928.5445,14.99461984,137982.0475,133928.5445,8.088044986,7.850442236,22.8,27.7%
11/1/2025,2025-11-01 15:00:00.000 -0700,574.8586375,68.37423019,65.61671104,52712.73607,51000.73767,14.9944863,52712.73607,51000.73767,3.089843849,2.989492243,18.0,27.8%
11/1/2025,2025-11-01 16:00:00.000 -0700,528.6813126,64.94472497,65.99067383,-19994.35831,-19397.14681,14.99460042,19994.35831,19397.14681,1.172002246,1.13699571,16.1,27.9%
11/1/2025,2025-11-01 17:00:00.000 -0700,635.6931905,60.9123359,66.31828308,-103340.0862,-99628.64052,14.99430534,103340.0862,99628.64052,6.057449369,5.839896865,20.8,27.7%
11/1/2025,2025-11-01 18:00:00.000 -0700,672.8332474,59.14938685,66.32820129,-137230.2169,-132013.6603,14.99417634,137230.2169,132013.6603,8.043975199,7.738198139,22.7,27.6%
11/1/2025,2025-11-01 19:00:00.000 -0700,670.8805115,59.34816634,66.32820129,-133430.3482,-128372.9572,14.99418349,133430.3482,128372.9572,7.821239637,7.524792335,22.5,27.6%
11/1/2025,2025-11-01 20:00:00.000 -0700,687.7758794,59.4214447,66.32820129,-132029.559,-126899.2344,14.99412023,132029.559,126899.2344,7.739130071,7.438407642,22.4,27.6%
11/1/2025,2025-11-01 21:00:00.000 -0700,699.0218516,59.04651597,66.27365252,-138153.9423,-132697.8618,14.99407637,138153.9423,132697.8618,8.098120883,7.778303738,22.8,27.6%
11/1/2025,2025-11-01 22:00:00.000 -0700,718.5215764,58.93397503,66.03066254,-135660.2784,-130153.2255,14.9939969,135660.2784,130153.2255,7.951950668,7.629145689,22.6,27.6%
11/1/2025,2025-11-01 23:00:00.000 -0700,726.29151,58.91455669,63.56624425,-88921.65937,-85272.89969,14.993964,88921.65937,85272.89969,5.212289529,4.998411471,20.0,27.7%
11/2/2025,2025-11-02 00:00:00.000 -0700,714.6600032,58.71858794,59.17137381,-8655.454756,-8305.979766,14.99401298,8655.454756,8305.979766,0.5073537372,0.486868685,15.5,28.0%
11/2/2025,2025-11-02 01:00:00.000 -0700,733.2976344,58.12462419,59.15441723,-19685.52375,-18869.96737,14.99393373,19685.52375,18869.96737,1.153899399,1.106094219,16.1,27.9%
11/2/2025,2025-11-02 01:00:00.000 -0800,761.3417806,58.03519751,61.89563147,-73796.05558,-70621.81714,14.99380666,73796.05558,70621.81714,4.325677349,4.139614135,19.1,27.7%
11/2/2025,2025-11-02 02:00:00.000 -0800,755.2759349,57.52745285,63.19363918,-108314.8179,-103692.921,14.99383495,108314.8179,103692.921,6.349051462,6.078131361,21.1,27.6%
11/2/2025,2025-11-02 03:00:00.000 -0800,800.70277,57.61815968,63.83936927,-118924.6425,-113544.7956,14.99361184,118924.6425,113544.7956,6.970963805,6.655615216,21.6,27.6%
11/2/2025,2025-11-02 04:00:00.000 -0800,764.0138774,57.66407235,64.00118033,-121140.1561,-115911.1866,14.99379405,121140.1561,115911.1866,7.100829782,6.794325121,21.8,27.6%
11/2/2025,2025-11-02 05:00:00.000 -0800,756.7847738,57.59147059,60.11570326,-48253.23179,-46190.10687,14.99382796,48253.23179,46190.10687,2.828442661,2.707509195,17.7,27.8%
11/2/2025,2025-11-02 06:00:00.000 -0800,782.7854034,56.92045301,58.94518369,-38704.75172,-36993.02773,14.99370296,38704.75172,36993.02773,2.268742774,2.168407253,17.2,27.8%
11/2/2025,2025-11-02 07:00:00.000 -0800,787.3703603,57.20928574,61.03094482,-73054.83513,-69805.04915,14.99368003,73054.83513,69805.04915,4.282229492,4.091737934,19.1,27.7%
11/2/2025,2025-11-02 08:00:00.000 -0800,717.8127172,60.97184683,62.90285581,-36913.16756,-35416.17654,14.99399986,36913.16756,35416.17654,2.163726117,2.075977523,17.1,27.9%
11/2/2025,2025-11-02 09:00:00.000 -0800,467.2066345,68.54430771,63.46609802,97075.05636,94512.67725,14.99472423,97075.05636,94512.67725,5.690214324,5.540016251,20.5,27.8%
11/2/2025,2025-11-02 10:00:00.000 -0800,384.086791,74.37505023,63.93920759,199491.5679,195162.6371,14.99484678,199491.5679,195162.6371,11.69352684,11.43977943,26.4,27.7%
11/2/2025,2025-11-02 11:00:00.000 -0800,660.065952,71.99704717,62.43217767,182842.0453,176023.5251,14.99422234,182842.0453,176023.5251,10.71758765,10.31790886,25.3,27.6%
11/2/2025,2025-11-02 12:00:00.000 -0800,555.6879537,71.31377831,58.25060946,249715.5356,241875.7664,14.994536,249715.5356,241875.7664,14.63748743,14.17794645,29.2,27.6%
11/2/2025,2025-11-02 13:00:00.000 -0800,535.534844,72.25625292,60.04140606,233499.0127,226434.2185,14.99458467,233499.0127,226434.2185,13.68692923,13.27281468,28.3,27.6%
11/2/2025,2025-11-02 14:00:00.000 -0800,509.4909322,67.04681244,59.1594635,150774.5623,146434.5469,14.99464237,150774.5623,146434.5469,8.837899314,8.583502164,23.6,27.7%
11/2/2025,2025-11-02 15:00:00.000 -0800,482.3964539,64.48365714,59.50106182,95247.29207,92651.41885,14.99469644,95247.29207,92651.41885,5.583076909,5.430915525,20.4,27.8%
11/2/2025,2025-11-02 16:00:00.000 -0800,637.8419759,62.06959559,62.49261233,-8086.387981,-7794.984721,14.99429828,8086.387981,7794.984721,0.4739969508,0.4569158688,15.5,28.0%
11/2/2025,2025-11-02 17:00:00.000 -0800,694.9847555,59.69923147,63.69806309,-76441.66528,-73440.2081,14.99409228,76441.66528,73440.2081,4.48075412,4.304818763,19.3,27.7%
11/2/2025,2025-11-02 18:00:00.000 -0800,740.6298859,58.42955805,60.68605544,-43135.20398,-41330.27622,14.99390142,43135.20398,41330.27622,2.52844103,2.422642217,17.4,27.8%
11/2/2025,2025-11-02 19:00:00.000 -0800,749.3311656,57.92553393,59.14581381,-23326.87027,-22339.32502,14.99386225,23326.87027,22339.32502,1.367342923,1.309456332,16.3,27.9%
11/2/2025,2025-11-02 20:00:00.000 -0800,727.5777049,58.51521772,60.36473173,-35355.30977,-33901.9914,14.99395849,35355.30977,33901.9914,2.072409717,1.987221067,17.0,27.9%
11/2/2025,2025-11-02 21:00:00.000 -0800,753.4944499,58.78324566,62.5551075,-72102.91092,-69033.4678,14.99384318,72102.91092,69033.4678,4.226430886,4.046510422,19.0,27.7%
11/2/2025,2025-11-02 22:00:00.000 -0800,731.9986816,58.81153978,63.1668457,-83256.02808,-79812.90363,14.99393939,83256.02808,79812.90363,4.880189219,4.678364808,19.7,27.7%
11/2/2025,2025-11-02 23:00:00.000 -0800,764.6645457,58.38360888,60.23147125,-35323.73708,-33797.70265,14.99379096,35323.73708,33797.70265,2.070559032,1.98110801,17.0,27.9%
11/3/2025,2025-11-03 00:00:00.000 -0800,779.0174479,57.16111514,59.04883715,-36085.69405,-34497.48019,14.9937216,36085.69405,34497.48019,2.115222394,2.022126623,17.0,27.8%
11/3/2025,2025-11-03 01:00:00.000 -0800,810.9908641,56.08134302,60.03965937,-75667.1755,-72200.20442,14.99355764,75667.1755,72200.20442,4.435356125,4.232133905,19.2,27.7%
11/3/2025,2025-11-03 02:00:00.000 -0800,791.9351278,56.17843844,59.08888931,-55636.17887,-53146.89952,14.99365694,55636.17887,53146.89952,3.261206264,3.115293055,18.1,27.8%
11/3/2025,2025-11-03 03:00:00.000 -0800,844.0651978,56.20091235,59.76621698,-68154.36329,-64904.26577,14.99337387,68154.36329,64904.26577,3.994980263,3.804470444,18.8,27.7%
11/3/2025,2025-11-03 04:00:00.000 -0800,795.0887522,56.14569556,59.22115993,-58790.57701,-56149.6885,14.99364083,58790.57701,56149.6885,3.446106507,3.291306477,18.3,27.8%
11/3/2025,2025-11-03 05:00:00.000 -0800,802.803007,56.47508717,59.07026539,-49609.4269,-47359.33667,14.99360088,49609.4269,47359.33667,2.907938271,2.776045526,17.8,27.8%
11/3/2025,2025-11-03 06:00:00.000 -0800,2121.914296,56.92986126,59.09609114,-41409.65046,-36445.37197,14.9691649,41409.65046,36445.37197,2.427294869,2.136305508,17.1,27.5%
11/3/2025,2025-11-03 07:00:00.000 -0800,2356.536932,58.04664682,59.04211082,-19029.28996,-16495.77445,14.95961254,19029.28996,16495.77445,1.115433175,0.9669269898,15.9,27.7%
11/3/2025,2025-11-03 08:00:00.000 -0800,2335.911772,60.5086942,58.8726148,31275.29394,27147.81782,14.9605336,31275.29394,27147.81782,1.833252869,1.591314058,16.6,27.5%
11/3/2025,2025-11-03 09:00:00.000 -0800,2348.848914,63.92889722,58.99323483,94350.12238,81829.5471,14.95995776,94350.12238,81829.5471,5.53048783,4.796573687,19.8,27.0%
11/3/2025,2025-11-03 10:00:00.000 -0800,2352.271761,68.92199084,59.46958936,180692.1067,156678.7202,14.95980434,180692.1067,156678.7202,10.59156546,9.183981256,24.1,26.4%
11/3/2025,2025-11-03 11:00:00.000 -0800,2356.504075,71.85704536,59.73097426,231801.9752,200940.8284,14.95961402,231801.9752,200940.8284,13.58745458,11.77847763,26.7,26.2%
11/3/2025,2025-11-03 12:00:00.000 -0800,2334.864022,75.66855863,59.81804899,302998.3423,263028.8549,14.96057995,302998.3423,263028.8549,17.76074691,15.41786957,30.4,26.0%
11/3/2025,2025-11-03 13:00:00.000 -0800,2365.858744,74.44144135,58.89808731,297126.7557,257411.5053,14.95919092,297126.7557,257411.5053,17.41657419,15.08859937,30.0,26.0%
11/3/2025,2025-11-03 14:00:00.000 -0800,2339.49585,69.14925207,58.10540199,211114.238,183210.2333,14.9603747,211114.238,183210.2333,12.37480879,10.73916959,25.7,26.3%
11/3/2025,2025-11-03 15:00:00.000 -0800,2359.146724,66.21476758,58.26073195,152049.3451,131783.4291,14.95949484,152049.3451,131783.4291,8.91262281,7.724702759,22.7,26.6%
11/3/2025,2025-11-03 16:00:00.000 -0800,2361.950948,62.55526969,58.84378897,70948.66531,61481.02309,14.95936807,70948.66531,61481.02309,4.158772879,3.603811435,18.6,27.1%
11/3/2025,2025-11-03 17:00:00.000 -0800,2352.388444,59.18009923,59.14716053,629.6562447,545.9728507,14.9597991,629.6562447,545.9728507,0.03690833791,0.03200309793,15.0,27.9%
11/3/2025,2025-11-03 18:00:00.000 -0800,2338.340861,58.12591845,58.87315915,-14284.25327,-12397.16552,14.96042596,14284.25327,12397.16552,0.8372950331,0.7266802767,15.7,27.7%
11/3/2025,2025-11-03 19:00:00.000 -0800,2363.872231,58.92651685,58.85406704,1384.950593,1199.987528,14.95928105,1384.950593,1199.987528,0.08118116019,0.07033924548,15.0,27.9%
11/3/2025,2025-11-03 20:00:00.000 -0800,646.7725881,59.01868687,58.97838402,770.429258,742.2771379,14.99426839,770.429258,742.2771379,0.04515997995,0.04350979706,15.0,28.0%
11/3/2025,2025-11-03 21:00:00.000 -0800,716.6223969,57.67427985,58.79382362,-21401.1988,-20534.72545,14.99400483,21401.1988,20534.72545,1.254466518,1.203676755,16.2,27.9%
11/3/2025,2025-11-03 22:00:00.000 -0800,1523.238597,56.37814115,60.6565417,-81785.90488,-74747.51805,14.9854428,81785.90488,74747.51805,4.794015526,4.381448889,19.4,27.4%
11/3/2025,2025-11-03 23:00:00.000 -0800,2361.447272,55.48618577,61.2485302,-110152.976,-95456.90569,14.95939086,110152.976,95456.90569,6.456798125,5.595363757,20.6,26.8%
11/4/2025,2025-11-04 00:00:00.000 -0800,1733.940392,56.32246799,60.95162996,-88491.06006,-79822.23389,14.98090292,88491.06006,79822.23389,5.187049242,4.678911717,19.7,27.3%
11/4/2025,2025-11-04 01:00:00.000 -0800,2356.002146,56.94315001,59.48226916,-48537.80164,-42077.05786,14.95963662,48537.80164,42077.05786,2.845123191,2.466416053,17.4,27.4%
11/4/2025,2025-11-04 02:00:00.000 -0800,1676.779151,57.5115214,58.9237882,-26996.89205,-24439.38777,14.98225164,26996.89205,24439.38777,1.582467295,1.432554969,16.4,27.7%
11/4/2025,2025-11-04 03:00:00.000 -0800,692.868044,57.33596649,60.68441226,-64008.88925,-61503.25569,14.99410055,64008.88925,61503.25569,3.751986474,3.605114636,18.6,27.8%
11/4/2025,2025-11-04 04:00:00.000 -0800,707.8173904,57.59043967,59.24509246,-31630.34266,-30365.45528,14.99404106,31630.34266,30365.45528,1.854064634,1.779921177,16.8,27.9%
11/4/2025,2025-11-04 05:00:00.000 -0800,746.1997569,57.30258846,59.00101096,-32467.04442,-31098.29297,14.99387645,32467.04442,31098.29297,1.903109286,1.822877666,16.8,27.9%
11/4/2025,2025-11-04 06:00:00.000 -0800,2102.841483,57.0656573,58.83503532,-33823.43035,-29805.05112,14.96985531,33823.43035,29805.05112,1.982616082,1.747072164,16.7,27.6%
11/4/2025,2025-11-04 07:00:00.000 -0800,2337.863908,58.01055533,59.14999657,-21781.55866,-18904.59144,14.96044711,21781.55866,18904.59144,1.276761938,1.108123766,16.1,27.7%
11/4/2025,2025-11-04 08:00:00.000 -0800,2368.447095,60.80550512,58.92807007,35889.04839,31086.71435,14.95907327,35889.04839,31086.71435,2.103695685,1.822198966,16.8,27.5%
11/4/2025,2025-11-04 09:00:00.000 -0800,2403.499628,65.69683851,59.18339113,124511.0601,107603.5863,14.95745442,124511.0601,107603.5863,7.298420874,6.307361448,21.3,26.7%
11/4/2025,2025-11-04 10:00:00.000 -0800,2431.08666,70.82970568,59.49976819,216583.0851,186835.5004,14.95614669,216583.0851,186835.5004,12.69537427,10.9516706,25.9,26.2%
11/4/2025,2025-11-04 11:00:00.000 -0800,2407.15308,72.77147268,59.62763437,251257.6131,217087.2438,14.95728294,251257.6131,217087.2438,14.72787885,12.72492637,27.7,26.1%
11/4/2025,2025-11-04 12:00:00.000 -0800,2342.71153,76.15101598,59.7029911,314420.4435,272804.8278,14.96023173,314420.4435,272804.8278,18.43027219,15.99090433,31.0,25.9%
11/4/2025,2025-11-04 13:00:00.000 -0800,2360.19787,73.15512543,59.0817831,269026.0119,233152.8695,14.95944736,269026.0119,233152.8695,15.7694028,13.66663948,28.6,26.1%
11/4/2025,2025-11-04 14:00:00.000 -0800,2359.320374,67.52216377,58.16750291,178823.697,154987.4037,14.95948699,178823.697,154987.4037,10.48204555,9.084841952,24.0,26.4%
11/4/2025,2025-11-04 15:00:00.000 -0800,2348.505768,65.05465724,58.26801605,129733.4329,112519.8896,14.95997311,129733.4329,112519.8896,7.604538856,6.595538666,21.6,26.7%
11/4/2025,2025-11-04 16:00:00.000 -0800,2335.579303,61.89232807,58.83134747,58513.70527,50792.60928,14.96054831,58513.70527,50792.60928,3.429877214,2.977292455,17.9,27.3%
11/4/2025,2025-11-04 17:00:00.000 -0800,2344.217651,59.90219479,59.13745346,14618.79518,12682.65745,14.96016463,14618.79518,12682.65745,0.8569047583,0.7434148566,15.7,27.7%
11/4/2025,2025-11-04 18:00:00.000 -0800,2349.901571,58.84235433,58.59210567,4783.753283,4148.6488,14.95991062,4783.753283,4148.6488,0.2804075781,0.2431798827,15.2,27.9%
11/4/2025,2025-11-04 19:00:00.000 -0800,2348.425279,58.1028827,59.00235793,-17194.3684,-14913.03001,14.95997671,17194.3684,14913.03001,1.007876225,0.8741518179,15.8,27.7%
11/4/2025,2025-11-04 20:00:00.000 -0800,684.1918767,57.34169623,58.79008325,-27687.36625,-26617.11365,14.99413392,27687.36625,26617.11365,1.622940577,1.560205958,16.6,27.9%
11/4/2025,2025-11-04 21:00:00.000 -0800,693.0864421,58.04212456,58.78265762,-14156.03009,-13601.71638,14.9940997,14156.03009,13601.71638,0.8297790203,0.7972870096,15.8,27.9%
11/4/2025,2025-11-04 22:00:00.000 -0800,693.7129018,58.83650208,60.62867076,-34259.0965,-32916.38592,14.99409725,34259.0965,32916.38592,2.008153371,1.929448178,16.9,27.9%
11/4/2025,2025-11-04 23:00:00.000 -0800,666.4719838,58.75168196,62.81723213,-77717.05702,-74790.71571,14.99419948,77717.05702,74790.71571,4.555513307,4.383980991,19.4,27.8%
11/5/2025,2025-11-05 00:00:00.000 -0800,714.4378942,59.00883904,63.07687454,-77764.56676,-74625.69934,14.9940139,77764.56676,74625.69934,4.558298169,4.374308285,19.4,27.7%
11/5/2025,2025-11-05 01:00:00.000 -0800,668.147024,59.19689662,60.81607946,-30952.29919,-29783.89882,14.99419343,30952.29919,29783.89882,1.814319999,1.745832287,16.7,27.9%
11/5/2025,2025-11-05 02:00:00.000 -0800,698.1178009,59.63747044,58.99843057,12215.88608,11734.07097,14.99407995,12215.88608,11734.07097,0.7160542838,0.6878118972,15.7,27.9%
11/5/2025,2025-11-05 03:00:00.000 -0800,726.3657176,59.56259098,59.80106996,-4558.764153,-4371.683362,14.99396368,4558.764153,4371.683362,0.2672194697,0.256253421,15.3,28.0%
11/5/2025,2025-11-05 04:00:00.000 -0800,724.1887126,58.79175428,59.20845776,-7965.703695,-7639.789983,14.99397297,7965.703695,7639.789983,0.4669228426,0.4478188736,15.4,28.0%
11/5/2025,2025-11-05 05:00:00.000 -0800,766.3842784,57.33401667,58.8750021,-29457.47739,-28182.01143,14.99378279,29457.47739,28182.01143,1.726698557,1.651935019,16.6,27.9%
11/5/2025,2025-11-05 06:00:00.000 -0800,2096.656188,57.47434909,59.09505711,-30981.45452,-27311.54162,14.97007654,30981.45452,27311.54162,1.816028987,1.600910998,16.6,27.6%
11/5/2025,2025-11-05 07:00:00.000 -0800,2346.789164,60.04141572,59.03388913,19259.87826,16706.26959,14.96004986,19259.87826,16706.26959,1.128949488,0.9792655091,15.9,27.7%
11/5/2025,2025-11-05 08:00:00.000 -0800,2345.315641,63.94864133,58.90787226,96359.34151,83591.37141,14.96011566,96359.34151,83591.37141,5.648261519,4.899845921,19.9,26.9%
11/5/2025,2025-11-05 09:00:00.000 -0800,2368.725732,68.65579631,59.34025739,178075.8419,154244.6086,14.95906058,178075.8419,154244.6086,10.43820879,9.041301795,24.0,26.4%
11/5/2025,2025-11-05 10:00:00.000 -0800,2338.037197,70.13006121,59.07809277,211269.4288,183362.3224,14.96043943,211269.4288,183362.3224,12.38390556,10.74808455,25.7,26.3%
11/5/2025,2025-11-05 11:00:00.000 -0800,2369.299866,69.34224739,59.42296918,189616.9222,164235.0381,14.95903445,189616.9222,164235.0381,11.11470822,9.626907277,24.6,26.4%
11/5/2025,2025-11-05 12:00:00.000 -0800,2338.94726,69.54874636,59.67259706,188792.4701,163844.6944,14.96039906,188792.4701,163844.6944,11.0663816,9.604026634,24.6,26.4%
11/5/2025,2025-11-05 13:00:00.000 -0800,2370.275264,69.00244242,58.8632864,193820.1065,167864.9086,14.95899001,193820.1065,167864.9086,11.36108479,9.83967811,24.8,26.3%
11/5/2025,2025-11-05 14:00:00.000 -0800,2368.595022,65.26589292,58.28050715,133532.6343,115663.4404,14.95906653,133532.6343,115663.4404,7.827235307,6.779803071,21.7,26.7%
11/5/2025,2025-11-05 15:00:00.000 -0800,2353.637634,64.68963108,58.57452393,116896.3884,101352.2223,14.95974299,116896.3884,101352.2223,6.852074348,5.940927452,20.9,26.8%
11/5/2025,2025-11-05 16:00:00.000 -0800,2345.752938,61.71793633,59.08489577,50333.20326,43662.62363,14.96009614,50333.20326,43662.62363,2.950363614,2.559356602,17.5,27.3%
11/5/2025,2025-11-05 17:00:00.000 -0800,2352.631197,59.50911516,58.88956305,11843.35801,10269.1742,14.9597882,11843.35801,10269.1742,0.6942179375,0.6019445603,15.6,27.8%
11/5/2025,2025-11-05 18:00:00.000 -0800,2360.547941,58.96296024,59.00135358,-733.9270592,-636.0473977,14.95943153,733.9270592,636.0473977,0.04302034345,0.03728296587,15.0,27.9%
11/5/2025,2025-11-05 19:00:00.000 -0800,2352.930872,58.46024837,58.8750014,-7928.418803,-6874.462793,14.95977474,7928.418803,6874.462793,0.4647373272,0.4029579598,15.4,27.8%
11/5/2025,2025-11-05 20:00:00.000 -0800,688.5156937,57.29247634,58.88477306,-30438.34424,-29254.31725,14.99411739,30438.34424,29254.31725,1.784193684,1.714789991,16.7,27.9%
11/5/2025,2025-11-05 21:00:00.000 -0800,711.7874502,56.73857714,59.01154881,-43450.12629,-41702.82377,14.99402484,43450.12629,41702.82377,2.54690072,2.444479705,17.4,27.8%
11/5/2025,2025-11-05 22:00:00.000 -0800,745.8936452,56.59379527,59.84919821,-62230.28272,-59607.8436,14.99387783,62230.28272,59607.8436,3.647730523,3.494011935,18.5,27.8%
11/5/2025,2025-11-05 23:00:00.000 -0800,777.0886871,55.38237368,61.87248306,-124064.9309,-118618.0691,14.99373107,124064.9309,118618.0691,7.272270276,6.952993499,21.9,27.6%
11/6/2025,2025-11-06 00:00:00.000 -0800,824.2056905,54.34163265,63.0523646,-166514.352,-158760.5624,14.99348597,166514.352,158760.5624,9.760513012,9.306011861,24.3,27.5%
11/6/2025,2025-11-06 01:00:00.000 -0800,819.3073385,53.32766164,64.06995436,-205349.6677,-195844.3293,14.99351281,205349.6677,195844.3293,12.03690901,11.47973794,26.5,27.4%
11/6/2025,2025-11-06 02:00:00.000 -0800,829.3586945,53.34289551,64.25350952,-208567.2975,-198794.5799,14.9934574,208567.2975,198794.5799,12.22551568,11.65267174,26.6,27.4%
11/6/2025,2025-11-06 03:00:00.000 -0800,814.560198,52.52282848,62.94354102,-199202.3408,-190034.9793,14.99353851,199202.3408,190034.9793,11.67657332,11.13921333,26.1,27.4%
11/6/2025,2025-11-06 04:00:00.000 -0800,835.1893473,51.6912337,58.73302841,-134610.9477,-128259.2173,14.99342463,134610.9477,128259.2173,7.890442423,7.518125279,22.5,27.5%
11/6/2025,2025-11-06 05:00:00.000 -0800,854.2920614,50.81201884,58.87726974,-154175.3363,-146734.0501,14.99331405,154175.3363,146734.0501,9.037241284,8.601058036,23.6,27.5%
11/6/2025,2025-11-06 06:00:00.000 -0800,2123.797012,51.29693311,59.41500238,-155185.0121,-136564.5904,14.96909607,155185.0121,136564.5904,9.096425095,8.004958403,23.0,26.7%
11/6/2025,2025-11-06 07:00:00.000 -0800,2327.374866,54.78139928,58.97822393,-80226.49993,-69677.509,14.9609101,80226.49993,69677.509,4.702608437,4.084261958,19.0,27.1%
11/6/2025,2025-11-06 08:00:00.000 -0800,2354.808659,62.99977754,59.03857931,75722.26545,65648.17244,14.95969034,75722.26545,65648.17244,4.438585314,3.848075758,18.8,27.1%
11/6/2025,2025-11-06 09:00:00.000 -0800,2376.303025,66.92818413,59.18162505,148083.2234,128202.3978,14.95871458,148083.2234,128202.3978,8.680142049,7.514794715,22.5,26.6%
11/6/2025,2025-11-06 10:00:00.000 -0800,2337.648214,69.01390928,59.47400773,182364.7579,158279.7494,14.96045667,182364.7579,158279.7494,10.68961066,9.277828217,24.2,26.4%
11/6/2025,2025-11-06 11:00:00.000 -0800,2359.188637,69.43490206,59.46727651,190541.1301,165144.3804,14.95949294,190541.1301,165144.3804,11.16888219,9.680209873,24.6,26.4%
11/6/2025,2025-11-06 12:00:00.000 -0800,2357.306708,72.12147039,59.64529324,238494.6024,206731.6123,14.95957785,238494.6024,206731.6123,13.97975395,12.11791397,27.1,26.2%
11/6/2025,2025-11-06 13:00:00.000 -0800,2376.76182,70.6884669,58.93430882,224692.4859,194520.705,14.95869356,224692.4859,194520.705,13.17072016,11.40215153,26.4,26.2%
11/6/2025,2025-11-06 14:00:00.000 -0800,2341.146558,66.96621666,58.24979782,166623.0625,144584.1354,14.96030136,166623.0625,144584.1354,9.766885259,8.475037247,23.4,26.5%
11/6/2025,2025-11-06 15:00:00.000 -0800,2357.002747,64.25988483,58.56476421,108867.9258,94370.63765,14.95959155,108867.9258,94370.63765,6.381472789,5.531690366,20.5,26.8%
11/6/2025,2025-11-06 16:00:00.000 -0800,2363.010909,62.83600394,58.7899044,77345.23872,67019.38319,14.95932008,77345.23872,67019.38319,4.533718565,3.928451535,18.9,27.1%
11/6/2025,2025-11-06 17:00:00.000 -0800,2338.204236,62.04370918,58.91475163,59813.15267,51911.71951,14.96043202,59813.15267,51911.71951,3.506046464,3.042890944,18.0,27.2%
11/6/2025,2025-11-06 18:00:00.000 -0800,2361.439966,61.39759471,58.9399484,46980.36679,40712.49585,14.9593912,46980.36679,40712.49585,2.753831582,2.386430003,17.3,27.4%
11/6/2025,2025-11-06 19:00:00.000 -0800,2353.342741,60.92137489,58.96234983,37448.72314,32469.64514,14.95975624,37448.72314,32469.64514,2.19511859,1.903261731,16.9,27.5%
11/6/2025,2025-11-06 20:00:00.000 -0800,545.5094767,60.66685155,58.81848571,35333.36154,34244.39636,14.99456103,35333.36154,34244.39636,2.071123185,2.007291698,17.0,27.9%
11/6/2025,2025-11-06 21:00:00.000 -0800,589.9721278,60.88521169,58.78810927,40088.20985,38751.99932,14.99444471,40088.20985,38751.99932,2.349836451,2.271512269,17.3,27.9%
11/6/2025,2025-11-06 22:00:00.000 -0800,625.8195648,61.12417558,60.48250701,12266.13646,11832.44221,14.99433721,12266.13646,11832.44221,0.7189997925,0.6935780899,15.7,28.0%
11/6/2025,2025-11-06 23:00:00.000 -0800,672.2104792,60.80912393,62.82175236,-38473.40503,-37012.26232,14.99417862,38473.40503,37012.26232,2.255182007,2.16953472,17.2,27.9%
11/7/2025,2025-11-07 00:00:00.000 -0800,2085.473409,60.38926487,63.17452399,-53243.01333,-46969.74279,14.97047321,53243.01333,46969.74279,3.120926924,2.753208839,17.7,27.4%
11/7/2025,2025-11-07 01:00:00.000 -0800,2367.751619,59.8687554,64.52278964,-88966.5184,-77065.35354,14.95910491,88966.5184,77065.35354,5.214919015,4.517312634,19.5,27.0%
11/7/2025,2025-11-07 02:00:00.000 -0800,656.7807943,59.2952947,64.67132568,-102768.2083,-98954.86451,14.9942339,102768.2083,98954.86451,6.023927803,5.800402374,20.8,27.7%
11/7/2025,2025-11-07 03:00:00.000 -0800,685.8575984,58.24182758,63.28037631,-96316.89741,-92584.71232,14.99412757,96316.89741,92584.71232,5.645773588,5.427005412,20.4,27.7%
11/7/2025,2025-11-07 04:00:00.000 -0800,719.4744929,57.38856335,59.34510549,-37401.25959,-35880.96285,14.9939929,37401.25959,35880.96285,2.192336436,2.103221738,17.1,27.9%
11/7/2025,2025-11-07 05:00:00.000 -0800,715.0341171,57.096853,58.85592111,-33626.34594,-32267.92874,14.99401143,33626.34594,32267.92874,1.971063654,1.891437792,16.9,27.9%
11/7/2025,2025-11-07 06:00:00.000 -0800,2125.677758,57.08958003,59.02198569,-36939.86665,-32503.58117,14.96902719,36939.86665,32503.58117,2.165291128,1.905250948,16.9,27.5%
11/7/2025,2025-11-07 07:00:00.000 -0800,2355.408862,57.83901622,59.04612376,-23075.06781,-20004.37746,14.95966333,23075.06781,20004.37746,1.352583107,1.172589535,16.1,27.6%
11/7/2025,2025-11-07 08:00:00.000 -0800,2358.011287,60.29735661,59.13315919,22254.79775,19289.99186,14.95954608,22254.79775,19289.99186,1.304501627,1.130714646,16.1,27.6%
11/7/2025,2025-11-07 09:00:00.000 -0800,2346.095964,65.62589442,59.0481329,125740.4893,109073.8647,14.96008082,125740.4893,109073.8647,7.370485889,6.39354424,21.4,26.7%
11/7/2025,2025-11-07 10:00:00.000 -0800,2357.318534,71.28858134,59.61392479,223172.7346,193450.1796,14.95957731,223172.7346,193450.1796,13.08163743,11.33940091,26.3,26.2%
11/7/2025,2025-11-07 11:00:00.000 -0800,2364.086084,71.04897766,59.62124557,218452.5266,189275.0928,14.95927136,218452.5266,189275.0928,12.80495466,11.09467132,26.1,26.2%
11/7/2025,2025-11-07 12:00:00.000 -0800,2361.52867,74.09331856,59.722848,274705.9151,238054.7347,14.95938718,274705.9151,238054.7347,16.10233969,13.95397038,28.9,26.0%
11/7/2025,2025-11-07 13:00:00.000 -0800,2341.457914,72.238775,58.93077374,254395.7522,220742.8173,14.96028751,254395.7522,220742.8173,14.91182604,12.93920383,27.9,26.1%
11/7/2025,2025-11-07 14:00:00.000 -0800,2361.799331,67.60170555,58.14375954,180798.096,156673.3038,14.95937494,180798.096,156673.3038,10.5977782,9.183663763,24.1,26.4%
11/7/2025,2025-11-07 15:00:00.000 -0800,2372.514445,66.17969449,58.40188821,148680.5449,128751.3505,14.95888786,148680.5449,128751.3505,8.715155034,7.54697248,22.5,26.6%
11/7/2025,2025-11-07 16:00:00.000 -0800,2349.98018,62.44704641,58.83292853,69087.47733,59914.92352,14.9599071,69087.47733,59914.92352,4.04967628,3.51201193,18.5,27.2%
11/7/2025,2025-11-07 17:00:00.000 -0800,2347.895931,59.66227436,58.85892092,15356.9043,13319.81881,14.96000039,15356.9043,13319.81881,0.9001702402,0.7807631191,15.7,27.7%
11/7/2025,2025-11-07 18:00:00.000 -0800,2351.618713,58.6885444,58.99473171,-5853.076653,-5075.437975,14.95983364,5853.076653,5075.437975,0.3430877288,0.2975051568,15.3,27.9%
11/7/2025,2025-11-07 19:00:00.000 -0800,2354.147107,58.48284086,58.84985224,-7015.789696,-6082.670994,14.95972009,7015.789696,6082.670994,0.4112420689,0.3565457793,15.3,27.8%
11/7/2025,2025-11-07 20:00:00.000 -0800,594.3963638,59.29526927,59.01867339,5287.406815,5109.846624,14.99443212,5287.406815,5109.846624,0.3099300595,0.2995220764,15.3,28.0%
11/7/2025,2025-11-07 21:00:00.000 -0800,633.9821945,59.46775335,58.96525135,9605.828162,9261.764659,14.99431094,9605.828162,9261.764659,0.5630614398,0.5428935908,15.5,28.0%
11/7/2025,2025-11-07 22:00:00.000 -0800,675.6474614,59.31780516,60.07779414,-14527.94926,-13973.38586,14.99416596,14527.94926,13973.38586,0.851579675,0.8190730284,15.8,27.9%
11/7/2025,2025-11-07 23:00:00.000 -0800,674.379952,58.83278929,62.00083084,-60560.28222,-58252.90141,14.99417064,60560.28222,58252.90141,3.549840693,3.414589766,18.4,27.8%
11/8/2025,2025-11-08 00:00:00.000 -0800,735.4321777,58.1148702,59.26756064,-22034.8305,-21119.2868,14.99392439,22034.8305,21119.2868,1.291607884,1.237941782,16.2,27.9%
11/8/2025,2025-11-08 01:00:00.000 -0800,806.2988566,56.38042558,58.96969573,-49496.48812,-47241.74452,14.99358253,49496.48812,47241.74452,2.901318178,2.769152668,17.8,27.8%
11/8/2025,2025-11-08 02:00:00.000 -0800,781.1243978,55.44450925,60.51538391,-96934.83999,-92656.97736,14.99371119,96934.83999,92656.97736,5.68199531,5.431241346,20.4,27.7%
11/8/2025,2025-11-08 03:00:00.000 -0800,799.2716085,54.56546224,59.36637878,-91774.32067,-87630.10547,14.99361927,91774.32067,87630.10547,5.37950297,5.13658297,20.1,27.7%
11/8/2025,2025-11-08 04:00:00.000 -0800,818.022049,54.94117654,59.3653717,-84572.91473,-80664.2984,14.9935198,84572.91473,80664.2984,4.957380699,4.728270715,19.7,27.7%
11/8/2025,2025-11-08 05:00:00.000 -0800,825.4896637,54.94697997,59.08311195,-79066.29904,-75378.81811,14.99347889,79066.29904,75378.81811,4.634601351,4.418453582,19.4,27.7%
11/8/2025,2025-11-08 06:00:00.000 -0800,859.9647319,53.95265808,59.05576057,-97550.90726,-92811.34004,14.99328024,97550.90726,92811.34004,5.718107108,5.440289569,20.4,27.6%
11/8/2025,2025-11-08 07:00:00.000 -0800,851.8714722,54.47205626,60.90467141,-122965.8713,-117047.729,14.99332834,122965.8713,117047.729,7.207847085,6.860945429,21.9,27.6%
11/8/2025,2025-11-08 08:00:00.000 -0800,706.8048757,57.25721448,62.29380328,-96279.43142,-92434.75506,14.99404517,96279.43142,92434.75506,5.643577457,5.41821542,20.4,27.7%
11/8/2025,2025-11-08 09:00:00.000 -0800,559.9089996,63.1731315,62.88652916,5478.690296,5305.381369,14.99452534,5478.690296,5305.381369,0.3211424558,0.3109836676,15.3,28.0%
11/8/2025,2025-11-08 10:00:00.000 -0800,412.7906835,68.82363968,63.4561367,102605.1869,100212.2792,14.9948098,102605.1869,100212.2792,6.014372033,5.87410781,20.9,27.8%
11/8/2025,2025-11-08 11:00:00.000 -0800,529.5885534,72.15835228,64.2019865,152093.8882,147543.1999,14.99459835,152093.8882,147543.1999,8.915233773,8.648487685,23.6,27.7%
11/8/2025,2025-11-08 12:00:00.000 -0800,560.4109472,74.73516477,64.83918304,189171.5867,183182.1048,14.99452407,189171.5867,183182.1048,11.08860414,10.7375208,25.7,27.6%
11/8/2025,2025-11-08 13:00:00.000 -0800,545.0171539,72.499285,65.69233144,130121.7242,126115.0252,14.99456222,130121.7242,126115.0252,7.627299191,7.392439931,22.4,27.7%
11/8/2025,2025-11-08 14:00:00.000 -0800,1055.036443,67.31230647,64.41454455,55393.61681,52091.79283,14.99182438,55393.61681,52091.79283,3.24698809,3.053446239,18.0,27.7%
11/8/2025,2025-11-08 15:00:00.000 -0800,2327.648039,64.43080139,58.57814089,111879.4581,97166.68964,14.9608981,111879.4581,97166.68964,6.557998714,5.695585559,20.7,26.8%
11/8/2025,2025-11-08 16:00:00.000 -0800,1608.945844,61.21861566,59.19147847,38750.75441,35228.27615,14.98373708,38750.75441,35228.27615,2.271439297,2.064963432,17.0,27.6%
11/8/2025,2025-11-08 17:00:00.000 -0800,638.4747869,58.95101967,62.31909326,-64384.09476,-62061.63028,14.99429619,64384.09476,62061.63028,3.773979763,3.637844683,18.6,27.8%
11/8/2025,2025-11-08 18:00:00.000 -0800,747.891748,57.90585111,63.60893459,-109020.1439,-104413.6317,14.99386879,109020.1439,104413.6317,6.390395303,6.120377003,21.1,27.6%
11/8/2025,2025-11-08 19:00:00.000 -0800,777.0575511,56.9196214,64.2703715,-140516.9388,-134348.0265,14.99373122,140516.9388,134348.0265,8.23663182,7.875030862,22.9,27.6%
11/8/2025,2025-11-08 20:00:00.000 -0800,799.8714844,56.47954426,63.61937014,-136484.9116,-130317.093,14.99361616,136484.9116,130317.093,8.000287902,7.638751057,22.6,27.6%
11/8/2025,2025-11-08 21:00:00.000 -0800,816.9261851,56.33907267,59.3682497,-57905.7481,-55233.16495,14.99352574,57905.7481,55233.16495,3.394240803,3.237582939,18.2,27.8%
11/8/2025,2025-11-08 22:00:00.000 -0800,756.3010264,56.78976472,59.45271041,-50904.86969,-48729.76205,14.9938302,50904.86969,48729.76205,2.983872784,2.856375267,17.9,27.8%
11/8/2025,2025-11-08 23:00:00.000 -0800,753.6590932,56.76968613,61.94394468,-98911.12644,-94699.52927,14.99384242,98911.12644,94699.52927,5.797838596,5.550968891,20.5,27.7%
11/9/2025,2025-11-09 00:00:00.000 -0800,774.1993947,56.27408333,63.23094813,-132987.4276,-127170.547,14.99374517,132987.4276,127170.547,7.795277113,7.454311078,22.4,27.6%
11/9/2025,2025-11-09 01:00:00.000 -0800,796.6837718,54.94997183,61.36551463,-122639.516,-117119.4645,14.99363263,122639.516,117119.4645,7.188717235,6.865150322,21.9,27.6%
11/9/2025,2025-11-09 02:00:00.000 -0800,821.9465393,53.79973183,59.09467316,-101218.0985,-96517.76707,14.99349839,101218.0985,96517.76707,5.933065561,5.657547894,20.7,27.6%
11/9/2025,2025-11-09 03:00:00.000 -0800,824.852181,53.12406985,59.41130422,-120186.7722,-114585.8501,14.99348241,120186.7722,114585.8501,7.044945616,6.716638342,21.7,27.6%
11/9/2025,2025-11-09 04:00:00.000 -0800,848.2662394,52.93227533,60.077996,-136597.5964,-130051.2049,14.99334947,136597.5964,130051.2049,8.006893105,7.623165585,22.6,27.5%
11/9/2025,2025-11-09 05:00:00.000 -0800,840.1122325,53.21953824,59.57388929,-121469.7746,-115704.3371,14.99339661,121469.7746,115704.3371,7.120150912,6.782200297,21.8,27.6%
11/9/2025,2025-11-09 06:00:00.000 -0800,835.982135,52.8179952,59.3645724,-125144.3697,-119233.7224,14.99342014,125144.3697,119233.7224,7.335543361,6.989081033,22.0,27.6%
11/9/2025,2025-11-09 07:00:00.000 -0800,827.4941844,52.43298276,59.15339006,-128467.3059,-122461.3201,14.99346778,128467.3059,122461.3201,7.530322735,7.178271985,22.2,27.6%
11/9/2025,2025-11-09 08:00:00.000 -0800,772.5620794,55.12437763,59.47728367,-83210.15179,-79578.23044,14.99375311,83210.15179,79578.23044,4.877500105,4.664609053,19.7,27.7%
11/9/2025,2025-11-09 09:00:00.000 -0800,621.6086945,60.99649919,59.61348604,26437.67943,25509.21099,14.9943505,26437.67943,25509.21099,1.549688126,1.495264419,16.5,27.9%
11/9/2025,2025-11-09 10:00:00.000 -0800,395.7771581,69.014615,59.28881734,185918.3479,181761.1595,14.99483236,185918.3479,181761.1595,10.8979102,10.65422975,25.6,27.7%
11/9/2025,2025-11-09 11:00:00.000 -0800,538.9503184,72.96352221,61.92891509,210937.5498,204514.6764,14.99457668,210937.5498,204514.6764,12.36445192,11.98796462,27.0,27.6%
11/9/2025,2025-11-09 12:00:00.000 -0800,593.6230428,75.80869344,64.67753995,212783.1301,205646.8041,14.99443434,212783.1301,205646.8041,12.47263365,12.05432615,27.0,27.6%
11/9/2025,2025-11-09 13:00:00.000 -0800,526.3876282,75.79786008,66.2026226,183422.5596,177967.6802,14.99460559,183422.5596,177967.6802,10.75161545,10.43186871,25.4,27.7%
11/9/2025,2025-11-09 14:00:00.000 -0800,569.888269,67.7912576,66.65406036,21738.66244,21038.74105,14.99449951,21738.66244,21038.74105,1.274247505,1.23322046,16.2,27.9%
11/9/2025,2025-11-09 15:00:00.000 -0800,505.2412231,64.83003114,66.90277227,-39622.51938,-38491.50638,14.99465124,39622.51938,38491.50638,2.322539237,2.256243047,17.3,27.9%
11/9/2025,2025-11-09 16:00:00.000 -0800,644.4514923,61.05908508,67.07252502,-114952.9179,-110767.5179,14.99427624,114952.9179,110767.5179,6.738154626,6.492820513,21.5,27.7%
11/9/2025,2025-11-09 17:00:00.000 -0800,654.8038783,60.16978149,67.25254059,-135394.0228,-130385.1793,14.99424079,135394.0228,130385.1793,7.93634366,7.642742044,22.6,27.6%
11/9/2025,2025-11-09 18:00:00.000 -0800,681.6214951,59.84919122,67.25254059,-141522.4265,-136072.4419,14.99414364,141522.4265,136072.4419,8.295570136,7.97611031,23.0,27.6%
11/9/2025,2025-11-09 19:00:00.000 -0800,689.8524618,59.46760788,67.09345856,-145775.7616,-140094.1927,14.99411224,145775.7616,140094.1927,8.544886375,8.21185186,23.2,27.6%
11/9/2025,2025-11-09 20:00:00.000 -0800,736.4937576,59.07959894,66.95426178,-150532.0549,-144268.4437,14.99391973,150532.0549,144268.4437,8.823684345,8.456532456,23.5,27.6%
11/9/2025,2025-11-09 21:00:00.000 -0800,714.9084101,58.90639343,66.82029381,-151282.1196,-145171.7885,14.99401195,151282.1196,145171.7885,8.86765062,8.509483501,23.5,27.6%
11/9/2025,2025-11-09 22:00:00.000 -0800,737.5903829,58.31667957,66.65655518,-159425.062,-152781.537,14.99391489,159425.062,152781.537,9.344962604,8.955541443,23.9,27.6%
11/9/2025,2025-11-09 23:00:00.000 -0800,732.566982,58.11400731,66.50747681,-160449.5628,-153808.8819,14.99393691,160449.5628,153808.8819,9.405015406,9.015760956,24.0,27.6%
11/10/2025,2025-11-10 00:00:00.000 -0800,780.912207,57.2655838,66.35839844,-173818.2446,-166149.4994,14.99371224,173818.2446,166149.4994,10.18864271,9.739126579,24.7,27.5%
11/10/2025,2025-11-10 01:00:00.000 -0800,806.1516357,55.55993411,66.35839844,-206423.4441,-197021.8285,14.9935833,206423.4441,197021.8285,12.09985018,11.548759,26.5,27.4%
11/10/2025,2025-11-10 02:00:00.000 -0800,784.1319702,55.39659856,65.95472247,-201829.0966,-192887.8171,14.99369625,201829.0966,192887.8171,11.83054494,11.30643711,26.3,27.5%
11/10/2025,2025-11-10 03:00:00.000 -0800,805.1862254,56.07091433,61.90169697,-111461.2409,-106390.7857,14.99358839,111461.2409,106390.7857,6.533484224,6.236271145,21.2,27.6%
11/10/2025,2025-11-10 04:00:00.000 -0800,739.6984227,56.83592072,59.1292017,-43838.35927,-42006.31604,14.99390556,43838.35927,42006.31604,2.569657636,2.462269404,17.5,27.8%
11/10/2025,2025-11-10 05:00:00.000 -0800,765.3291809,56.26011766,58.88779647,-50230.70809,-48058.78567,14.99378781,50230.70809,48058.78567,2.944355691,2.817044881,17.8,27.8%
11/10/2025,2025-11-10 06:00:00.000 -0800,2126.274486,54.69024251,58.99839071,-82354.56086,-72461.43083,14.96900531,82354.56086,72461.43083,4.827348234,4.247446121,19.2,27.1%
11/10/2025,2025-11-10 07:00:00.000 -0800,2361.206991,55.06443227,59.04981308,-76184.53954,-66021.40579,14.95940173,76184.53954,66021.40579,4.465682271,3.869953446,18.8,27.1%
11/10/2025,2025-11-10 08:00:00.000 -0800,2339.039889,63.27114194,59.04804128,80728.79226,70060.55128,14.96039494,80728.79226,70060.55128,4.732051129,4.106714612,19.1,27.1%
11/10/2025,2025-11-10 09:00:00.000 -0800,2354.299801,73.79570249,59.27378356,277601.0023,240676.9354,14.95971322,277601.0023,240676.9354,16.27204,14.10767499,29.1,26.0%
11/10/2025,2025-11-10 10:00:00.000 -0800,2343.178992,80.67411296,59.85877399,397906.0196,345230.0294,14.96021091,397906.0196,345230.0294,23.32391674,20.23622681,35.2,25.7%
11/10/2025,2025-11-10 11:00:00.000 -0800,2371.037252,78.79699999,59.47673492,369326.1871,319852.3934,14.95895527,369326.1871,319852.3934,21.64866278,18.74867488,33.7,25.8%
11/10/2025,2025-11-10 12:00:00.000 -0800,2367.001349,75.94265086,59.61451778,312128.5919,270387.9818,14.95913902,312128.5919,270387.9818,18.29593153,15.84923692,30.8,25.9%
11/10/2025,2025-11-10 13:00:00.000 -0800,2344.870534,76.668234,58.88950736,339858.1385,294834.2213,14.96013551,339858.1385,294834.2213,19.92134458,17.28219351,32.2,25.9%
11/10/2025,2025-11-10 14:00:00.000 -0800,2374.854285,66.48548292,58.22177092,157969.1185,136773.9977,14.95878091,157969.1185,136773.9977,9.259620074,8.017233158,23.0,26.5%
11/10/2025,2025-11-10 15:00:00.000 -0800,2360.928385,64.53697001,58.28090045,119591.0258,103639.283,14.95941433,119591.0258,103639.283,7.010024959,6.074987281,21.0,26.8%
11/10/2025,2025-11-10 16:00:00.000 -0800,2349.000435,61.39418926,58.72285639,51065.1991,44288.24007,14.95995097,51065.1991,44288.24007,2.993270756,2.59602814,17.6,27.3%
11/10/2025,2025-11-10 17:00:00.000 -0800,2345.708547,59.26595904,59.22926178,701.5048325,608.5372685,14.96009812,701.5048325,608.5372685,0.04111986122,0.03567041433,15.0,27.9%
11/10/2025,2025-11-10 18:00:00.000 -0800,2358.509029,58.37244657,58.81494344,-8458.770204,-7331.646707,14.95952362,8458.770204,7331.646707,0.4958247482,0.4297565479,15.4,27.8%
11/10/2025,2025-11-10 19:00:00.000 -0800,2354.510752,58.82020683,58.80705967,251.3211754,217.8896268,14.95970374,251.3211754,217.8896268,0.01473160465,0.01277195937,15.0,27.9%
11/10/2025,2025-11-10 20:00:00.000 -0800,610.9845459,58.84467392,58.94932709,-2000.549954,-1931.493169,14.99438324,2000.549954,1931.493169,0.1172655307,0.1132176535,15.1,28.0%
11/10/2025,2025-11-10 21:00:00.000 -0800,675.5062332,59.0712574,59.03643799,665.6078842,640.2054958,14.99416648,665.6078842,640.2054958,0.03901570247,0.03752669964,15.0,28.0%
11/10/2025,2025-11-10 22:00:00.000 -0800,715.0951233,58.38129768,60.95407848,-49181.27777,-47194.31213,14.99401118,49181.27777,47194.31213,2.882841604,2.76637234,17.8,27.8%
11/10/2025,2025-11-10 23:00:00.000 -0800,765.1027079,57.14985701,63.20635357,-115775.9882,-110771.4389,14.99378888,115775.9882,110771.4389,6.786400245,6.493050346,21.5,27.6%
11/11/2025,2025-11-11 00:00:00.000 -0800,805.3270681,55.82677517,63.50245253,-146728.2485,-140052.3033,14.99358765,146728.2485,140052.3033,8.600717964,8.20939644,23.2,27.5%
11/11/2025,2025-11-11 01:00:00.000 -0800,818.643984,54.1530564,64.6000178,-199704.1142,-190467.5847,14.99351642,199704.1142,190467.5847,11.70598559,11.1645712,26.2,27.4%
11/11/2025,2025-11-11 02:00:00.000 -0800,855.9048523,53.23459435,64.63985443,-218022.9518,-207480.189,14.99330448,218022.9518,207480.189,12.77977443,12.16179302,27.2,27.4%
11/11/2025,2025-11-11 03:00:00.000 -0800,799.9170746,54.26902472,63.09087048,-168638.4034,-161017.1188,14.99361592,168638.4034,161017.1188,9.885017786,9.438283633,24.4,27.5%
11/11/2025,2025-11-11 04:00:00.000 -0800,802.0812032,55.10716031,59.29239349,-80004.91746,-76379.46885,14.99360465,80004.91746,76379.46885,4.689620015,4.477108373,19.5,27.7%
11/11/2025,2025-11-11 05:00:00.000 -0800,816.2690572,54.19364726,59.02477372,-92351.81355,-88092.83458,14.99352929,92351.81355,88092.83458,5.413353667,5.163706599,20.2,27.7%
11/11/2025,2025-11-11 06:00:00.000 -0800,2211.502112,52.68862464,58.87706642,-118298.2532,-103517.6409,14.9657525,118298.2532,103517.6409,6.934246962,6.067857029,21.0,26.9%
11/11/2025,2025-11-11 07:00:00.000 -0800,2357.714823,54.26926295,59.07881323,-91939.36325,-79692.65141,14.95955945,91939.36325,79692.65141,5.389177213,4.671316027,19.6,27.0%
11/11/2025,2025-11-11 08:00:00.000 -0800,2367.467468,61.06192004,59.08772252,37738.75969,32691.00343,14.95911783,37738.75969,32691.00343,2.21211956,1.916237012,16.9,27.5%
11/11/2025,2025-11-11 09:00:00.000 -0800,2349.170605,69.90855039,59.33100382,202200.3801,175364.0417,14.95994336,202200.3801,175364.0417,11.85230833,10.27925215,25.2,26.3%
11/11/2025,2025-11-11 10:00:00.000 -0800,2361.605131,70.35584895,59.61416403,205338.0488,177941.0211,14.95938372,205338.0488,177941.0211,12.03622795,10.43030605,25.4,26.3%
11/11/2025,2025-11-11 11:00:00.000 -0800,2340.931425,68.46339798,59.42373161,172802.2623,149948.1241,14.96031092,172802.2623,149948.1241,10.12908923,8.789456276,23.7,26.5%
11/11/2025,2025-11-11 12:00:00.000 -0800,2346.846777,73.72401479,59.95310465,263244.7182,228341.0448,14.96004729,263244.7182,228341.0448,15.43052275,13.38458645,28.3,26.1%
11/11/2025,2025-11-11 13:00:00.000 -0800,2342.098912,73.07794418,58.63853207,276023.802,239499.7881,14.960259,276023.802,239499.7881,16.1795898,14.03867457,29.0,26.0%
11/11/2025,2025-11-11 14:00:00.000 -0800,2348.587382,66.65061887,58.28778152,159863.9987,138651.8761,14.95996946,159863.9987,138651.8761,9.370691601,8.127308095,23.1,26.5%
11/11/2025,2025-11-11 15:00:00.000 -0800,2355.099518,66.15875549,58.57102807,145046.9974,125747.5559,14.95967725,145046.9974,125747.5559,8.502168661,7.370900112,22.3,26.6%
11/11/2025,2025-11-11 16:00:00.000 -0800,2344.068799,62.09768384,58.76547101,63698.58045,55262.76944,14.96017126,63698.58045,55262.76944,3.733797213,3.239318255,18.2,27.2%
11/11/2025,2025-11-11 17:00:00.000 -0800,2370.585565,60.32813225,59.10639954,23354.64252,20226.72283,14.95897586,23354.64252,20226.72283,1.368970839,1.185622675,16.1,27.6%
11/11/2025,2025-11-11 18:00:00.000 -0800,2348.309847,58.95452862,58.69389458,4982.280325,4321.266881,14.95998188,4982.280325,4321.266881,0.2920445677,0.2532981759,15.2,27.9%
11/11/2025,2025-11-11 19:00:00.000 -0800,2346.434379,58.91039429,58.87667796,644.521344,559.0791384,14.96006571,644.521344,559.0791384,0.03777968019,0.03277134457,15.0,27.9%
11/11/2025,2025-11-11 20:00:00.000 -0800,700.2199865,59.14178664,58.84999917,5577.809189,5357.148541,14.99407161,5577.809189,5357.148541,0.326952473,0.3140180856,15.3,28.0%
11/11/2025,2025-11-11 21:00:00.000 -0800,2353.764705,59.50396233,58.83801905,12730.1716,11037.29993,14.95973728,12730.1716,11037.29993,0.7461999768,0.6469695153,15.6,27.8%
11/11/2025,2025-11-11 22:00:00.000 -0800,2051.316006,59.65663668,59.9703481,-5996.907518,-5301.904559,14.97165874,5996.907518,5301.904559,0.3515186118,0.3107798686,15.3,27.9%
11/11/2025,2025-11-11 23:00:00.000 -0800,617.8604238,58.87239374,58.97485383,-1958.627238,-1890.256716,14.99436218,1958.627238,1890.256716,0.1148081617,0.1108005109,15.1,28.0%
11/12/2025,2025-11-12 00:00:00.000 -0800,716.0555267,58.50604706,59.43328234,-17725.02972,-17007.96161,14.99400719,17725.02972,17007.96161,1.038981812,0.996949684,16.0,27.9%
11/12/2025,2025-11-12 01:00:00.000 -0800,694.6606537,58.24021295,61.72376359,-66591.55411,-63978.0777,14.99409355,66591.55411,63978.0777,3.903373629,3.750180404,18.7,27.8%
11/12/2025,2025-11-12 02:00:00.000 -0800,712.2694941,58.58775457,62.78921343,-80315.08771,-77083.11105,14.99402285,80315.08771,77083.11105,4.707801155,4.51835352,19.5,27.7%
11/12/2025,2025-11-12 03:00:00.000 -0800,699.9860555,58.77524815,62.69999154,-75025.3948,-72058.34789,14.99407254,75025.3948,72058.34789,4.397737092,4.223818751,19.2,27.7%
11/12/2025,2025-11-12 04:00:00.000 -0800,700.5004862,58.84112956,59.22875474,-7409.843049,-7116.588887,14.99407049,7409.843049,7116.588887,0.4343401553,0.4171505796,15.4,28.0%
11/12/2025,2025-11-12 05:00:00.000 -0800,730.9418915,58.20178541,59.08810724,-16942.92812,-16243.25038,14.99394397,16942.92812,16243.25038,0.9931376387,0.9521248758,15.9,27.9%
11/12/2025,2025-11-12 06:00:00.000 -0800,2151.64238,57.37599545,58.8427564,-28038.60238,-24630.18175,14.96806376,28038.60238,24630.18175,1.643528862,1.443738672,16.4,27.6%
11/12/2025,2025-11-12 07:00:00.000 -0800,2349.979722,58.11988646,59.14948101,-19681.72939,-17068.64097,14.95990712,19681.72939,17068.64097,1.153676987,1.000506505,16.0,27.7%
11/12/2025,2025-11-12 08:00:00.000 -0800,2337.262872,63.06998711,58.87640603,80164.49578,69578.87433,14.96047375,80164.49578,69578.87433,4.698973961,4.078480324,19.0,27.1%
11/12/2025,2025-11-12 09:00:00.000 -0800,2355.877389,74.02432493,59.42487736,279083.0397,241936.9706,14.95964224,279083.0397,241936.9706,16.35891206,14.18153403,29.1,26.0%
11/12/2025,2025-11-12 10:00:00.000 -0800,2328.519478,72.88395106,59.86823031,248808.5178,216076.5698,14.96085978,248808.5178,216076.5698,14.58432109,12.66568404,27.6,26.2%
11/12/2025,2025-11-12 11:00:00.000 -0800,2345.071415,71.30924225,59.47923578,226142.4037,196180.8169,14.96012655,226142.4037,196180.8169,13.25570948,11.49946172,26.5,26.2%
11/12/2025,2025-11-12 12:00:00.000 -0800,2361.170345,69.77736588,59.55785802,195356.1121,169295.7133,14.95940339,195356.1121,169295.7133,11.45112029,9.923547088,24.9,26.3%
11/12/2025,2025-11-12 13:00:00.000 -0800,2339.481962,68.89674225,58.74667587,194028.6688,168383.0999,14.96037532,194028.6688,168383.0999,11.37331001,9.870052747,24.8,26.4%
11/12/2025,2025-11-12 14:00:00.000 -0800,2361.973098,69.48586973,58.6278389,207562.1173,179864.0305,14.95936707,207562.1173,179864.0305,12.16659539,10.5430264,25.5,26.3%
11/12/2025,2025-11-12 15:00:00.000 -0800,2354.920522,65.73786672,58.3846838,140563.4447,121861.9904,14.95968531,140563.4447,121861.9904,8.239357837,7.143141291,22.1,26.6%
11/12/2025,2025-11-12 16:00:00.000 -0800,2623.493359,62.79119403,58.81614914,75986.95805,64724.17387,14.94617227,75986.95805,64724.17387,4.454100706,3.793914061,18.7,27.0%
11/12/2025,2025-11-12 17:00:00.000 -0800,2404.317466,61.85496947,58.94161536,55691.67718,48126.67875,14.95741608,55691.67718,48126.67875,3.264459389,2.821024546,17.8,27.3%
11/12/2025,2025-11-12 18:00:00.000 -0800,2429.857479,61.55092475,59.05841408,47646.83394,41105.87259,14.9562056,47646.83394,41105.87259,2.792897652,2.409488429,17.4,27.3%
11/12/2025,2025-11-12 19:00:00.000 -0800,2428.305892,61.11868617,58.9085954,42248.09505,36451.97651,14.95627987,42248.09505,36451.97651,2.476441679,2.136692644,17.1,27.4%
11/12/2025,2025-11-12 20:00:00.000 -0800,594.1132192,60.39257774,58.4858071,36449.8276,35226.36295,14.99443293,36449.8276,35226.36295,2.136566683,2.064851286,17.1,27.9%
11/12/2025,2025-11-12 21:00:00.000 -0800,678.8194143,60.02784843,58.84842765,22545.8078,21681.14498,14.99415416,22545.8078,21681.14498,1.32155966,1.270876024,16.3,27.9%
11/12/2025,2025-11-12 22:00:00.000 -0800,722.4166718,59.0072066,60.65630824,-31524.22693,-30237.58133,14.99398049,31524.22693,30237.58133,1.847844486,1.772425635,16.8,27.9%
11/12/2025,2025-11-12 23:00:00.000 -0800,726.272053,58.16693999,62.97444426,-91900.25167,-88129.37119,14.99396408,91900.25167,88129.37119,5.386884623,5.165848253,20.2,27.7%
11/13/2025,2025-11-13 00:00:00.000 -0800,760.9230591,57.93099181,62.21408577,-81875.62416,-78355.7908,14.99380862,81875.62416,78355.7908,4.79927457,4.59295374,19.6,27.7%
11/13/2025,2025-11-13 01:00:00.000 -0800,786.597641,57.10072829,60.21178366,-59470.93453,-56828.01381,14.99368391,59470.93453,56828.01381,3.485986784,3.331067632,18.3,27.8%
11/13/2025,2025-11-13 02:00:00.000 -0800,772.5644918,56.95321687,58.88062731,-36844.37804,-35236.20526,14.9937531,36844.37804,35236.20526,2.159693906,2.06542821,17.1,27.8%
11/13/2025,2025-11-13 03:00:00.000 -0800,812.5327759,55.94342543,60.40772247,-85339.50222,-81421.92354,14.99354939,85339.50222,81421.92354,5.002315488,4.772680161,19.8,27.7%
11/13/2025,2025-11-13 04:00:00.000 -0800,819.3866669,55.45823491,59.41885789,-75711.26885,-72206.36466,14.99351238,75711.26885,72206.36466,4.43794073,4.232494998,19.2,27.7%
11/13/2025,2025-11-13 05:00:00.000 -0800,825.4983053,54.36902618,59.14362348,-91271.20189,-87014.46616,14.99347884,91271.20189,87014.46616,5.350011834,5.100496258,20.1,27.7%
11/13/2025,2025-11-13 06:00:00.000 -0800,2205.173359,54.4930556,58.95491409,-85292.88699,-74666.58179,14.96600288,85292.88699,74666.58179,4.999583059,4.376704677,19.3,27.1%
11/13/2025,2025-11-13 07:00:00.000 -0800,2364.364189,58.17034505,59.06018397,-17010.16076,-14737.94522,14.95925875,17010.16076,14737.94522,0.9970785907,0.8638889346,15.8,27.7%
11/13/2025,2025-11-13 08:00:00.000 -0800,2342.765023,67.83274326,58.98889275,169059.0465,146682.4577,14.96022935,169059.0465,146682.4577,9.909674472,8.598033865,23.6,26.5%
11/13/2025,2025-11-13 09:00:00.000 -0800,2359.461336,74.69682999,59.29967092,294332.0927,255096.7711,14.95948063,294332.0927,255096.7711,17.25276042,14.95291742,29.9,26.0%
11/13/2025,2025-11-13 10:00:00.000 -0800,2343.954152,76.93074875,59.47032668,333773.4283,289572.8852,14.96017637,333773.4283,289572.8852,19.56467927,16.97379163,31.9,25.9%
11/13/2025,2025-11-13 11:00:00.000 -0800,2351.855288,79.70264231,59.46564,386850.5361,335448.4752,14.95982303,386850.5361,335448.4752,22.67588137,19.6628649,34.6,25.7%
11/13/2025,2025-11-13 12:00:00.000 -0800,2386.956474,82.43823318,59.89101149,431012.6899,372887.9141,14.95822437,431012.6899,372887.9141,25.26451875,21.85743928,36.8,25.6%
11/13/2025,2025-11-13 13:00:00.000 -0800,2486.557589,74.84970729,58.92311128,304452.8092,261682.2192,14.95342596,304452.8092,261682.2192,17.84600289,15.3389343,30.3,25.8%
11/13/2025,2025-11-13 14:00:00.000 -0800,2528.241172,71.15624949,58.37188365,244385.9375,209478.2206,14.95129993,244385.9375,209478.2206,14.32508426,12.27891094,27.2,26.0%
11/13/2025,2025-11-13 15:00:00.000 -0800,2557.32253,69.29816386,57.88700174,218135.7751,186619.1914,14.94977452,218135.7751,186619.1914,12.78638776,10.93899129,25.9,26.1%
11/13/2025,2025-11-13 16:00:00.000 -0800,2576.136727,66.92990837,59.08028145,150053.4683,128214.0191,14.94876899,150053.4683,128214.0191,8.795631199,7.515475913,22.5,26.4%
11/13/2025,2025-11-13 17:00:00.000 -0800,2606.402588,66.69777629,59.16420962,144011.6604,122805.3121,14.94712033,144011.6604,122805.3121,8.441480679,7.198435646,22.1,26.5%
11/13/2025,2025-11-13 18:00:00.000 -0800,2646.135478,67.13161456,58.852005,158273.0162,134611.3301,14.9448971,158273.0162,134611.3301,9.277433541,7.890464839,22.8,26.3%
11/13/2025,2025-11-13 19:00:00.000 -0800,2556.000834,67.07807782,59.10822398,152351.7261,130351.0968,14.94984461,152351.7261,130351.0968,8.93034737,7.640744244,22.6,26.4%
11/13/2025,2025-11-13 20:00:00.000 -0800,2291.700207,64.16965071,58.75843976,103440.7085,90047.76541,14.96245382,103440.7085,90047.76541,6.06334751,5.27829809,20.2,26.9%
11/13/2025,2025-11-13 21:00:00.000 -0800,2583.393656,62.59982192,58.9006958,70712.49484,60391.69198,14.94837719,70712.49484,60391.69198,4.144929358,3.539958498,18.5,27.0%
11/13/2025,2025-11-13 22:00:00.000 -0800,730.2424352,62.43511569,60.6360637,34390.67773,32971.8341,14.993947,34390.67773,32971.8341,2.015866221,1.932698365,16.9,27.9%
11/13/2025,2025-11-13 23:00:00.000 -0800,573.2149862,62.07777475,63.21536694,-21746.21228,-21041.96059,14.99449069,21746.21228,21041.96059,1.274690051,1.233409179,16.2,27.9%
11/14/2025,2025-11-14 00:00:00.000 -0800,1158.365262,60.88561522,63.43644581,-48761.6775,-45570.50047,14.99079696,48761.6775,45570.50047,2.858246043,2.671189946,17.7,27.7%
11/14/2025,2025-11-14 01:00:00.000 -0800,2541.467916,59.87324181,64.62239889,-90784.88672,-77749.46995,14.95061047,90784.88672,77749.46995,5.32150567,4.557413245,19.5,26.9%
11/14/2025,2025-11-14 02:00:00.000 -0800,1623.960544,60.56419175,62.43234781,-35711.67108,-32435.15443,14.98341881,35711.67108,32435.15443,2.093298422,1.901240002,16.9,27.7%
11/14/2025,2025-11-14 03:00:00.000 -0800,655.3755188,60.26205661,58.92944031,25474.29314,24531.05992,14.9942388,25474.29314,24531.05992,1.493217652,1.437928483,16.4,27.9%
11/14/2025,2025-11-14 04:00:00.000 -0800,728.6306519,59.72314351,58.99115957,13992.60515,13416.59153,14.99395396,13992.60515,13416.59153,0.8201995982,0.7864356113,15.8,27.9%
11/14/2025,2025-11-14 05:00:00.000 -0800,738.9702159,59.66077499,58.98944448,12833.15414,12297.37342,14.99390879,12833.15414,12297.37342,0.7522364675,0.7208307983,15.7,27.9%
11/14/2025,2025-11-14 06:00:00.000 -0800,2154.225807,59.68584328,58.9707276,13670.15123,12006.38894,14.96796662,13670.15123,12006.38894,0.8012984309,0.7037742637,15.7,27.8%
11/14/2025,2025-11-14 07:00:00.000 -0800,2341.411556,61.18529383,59.04191151,40972.89656,35552.8732,14.96028957,40972.89656,35552.8732,2.401693819,2.083990223,17.0,27.4%
11/14/2025,2025-11-14 08:00:00.000 -0800,2354.879517,63.67484417,58.9289271,90722.95063,78652.80272,14.95968715,90722.95063,78652.80272,5.317875184,4.610363582,19.6,27.0%
11/14/2025,2025-11-14 09:00:00.000 -0800,2358.484383,65.96976852,59.28993174,127691.7599,110677.1259,14.95952473,127691.7599,110677.1259,7.484862832,6.487522036,21.4,26.7%
11/14/2025,2025-11-14 10:00:00.000 -0800,2351.815576,67.29681371,59.18687503,155029.5879,134430.6614,14.95982481,155029.5879,134430.6614,9.087314649,7.879874641,22.8,26.6%
11/14/2025,2025-11-14 11:00:00.000 -0800,2369.496108,66.11803157,59.2011048,132223.972,114523.1705,14.95902551,132223.972,114523.1705,7.750525911,6.712964274,21.7,26.7%
11/14/2025,2025-11-14 12:00:00.000 -0800,2385.736735,64.53635782,59.89815521,88663.88097,76713.10821,14.95828071,88663.88097,76713.10821,5.197179424,4.496665194,19.5,27.0%
11/14/2025,2025-11-14 13:00:00.000 -0800,2370.508248,64.75207545,59.20077883,106118.5861,91906.44014,14.95897939,106118.5861,91906.44014,6.220315715,5.38724737,20.3,26.9%
11/14/2025,2025-11-14 14:00:00.000 -0800,2376.337573,64.13228359,58.50373224,107595.3877,93150.02261,14.958713,107595.3877,93150.02261,6.306880875,5.460142005,20.4,26.8%
11/14/2025,2025-11-14 15:00:00.000 -0800,2371.460441,64.49710922,58.35538387,117405.2218,101675.1744,14.95893596,117405.2218,101675.1744,6.881900456,5.959857818,20.9,26.8%
11/14/2025,2025-11-14 16:00:00.000 -0800,2371.313652,64.03197556,58.85653839,98933.65683,85679.26525,14.95894266,98933.65683,85679.26525,5.799159252,5.022231257,20.0,26.9%
11/14/2025,2025-11-14 17:00:00.000 -0800,2385.226735,62.62564793,59.21202545,65254.80723,56461.16255,14.95830426,65254.80723,56461.16255,3.825018009,3.309564041,18.3,27.2%
11/14/2025,2025-11-14 18:00:00.000 -0800,2370.811051,61.88143311,58.85304864,57890.59739,50136.49185,14.95896558,57890.59739,50136.49185,3.393352719,2.938833051,17.9,27.3%
11/14/2025,2025-11-14 19:00:00.000 -0800,2380.775903,61.39506632,58.8208224,49209.24691,42590.25317,14.9585093,49209.24691,42590.25317,2.884481061,2.496497841,17.5,27.3%
11/14/2025,2025-11-14 20:00:00.000 -0800,563.5018916,61.70483564,59.03518664,51033.01023,49408.30979,14.99451615,51033.01023,49408.30979,2.991383952,2.89614946,17.9,27.9%
11/14/2025,2025-11-14 21:00:00.000 -0800,608.7558283,62.07263234,58.76615321,63206.65517,61032.78965,14.99438996,63206.65517,61032.78965,3.704962202,3.577537494,18.6,27.8%
11/14/2025,2025-11-14 22:00:00.000 -0800,1048.41055,62.1450386,60.40398439,33281.99241,31310.62563,14.99188383,33281.99241,31310.62563,1.950878805,1.835323894,16.8,27.8%
11/14/2025,2025-11-14 23:00:00.000 -0800,2366.176878,62.1653553,62.49716498,-6342.873837,-5494.943813,14.95917648,6342.873837,5494.943813,0.3717979975,0.3220951825,15.3,27.8%
11/15/2025,2025-11-15 00:00:00.000 -0800,718.5250331,62.21406657,63.11469574,-17216.42723,-16517.53265,14.99399688,17216.42723,16517.53265,1.00916924,0.968202383,16.0,27.9%
11/15/2025,2025-11-15 01:00:00.000 -0800,605.7583323,61.99671281,63.56084162,-29899.88637,-28876.60359,14.99439893,29899.88637,28876.60359,1.752631089,1.692649683,16.7,27.9%
11/15/2025,2025-11-15 02:00:00.000 -0800,627.5820964,61.17437344,63.89896774,-52083.34477,-50236.64564,14.9943316,52083.34477,50236.64564,3.052951042,2.94470373,17.9,27.8%
11/15/2025,2025-11-15 03:00:00.000 -0800,693.6074168,60.6866581,63.89896774,-61406.5112,-59000.18286,14.99409766,61406.5112,59000.18286,3.599443799,3.458392899,18.5,27.8%
11/15/2025,2025-11-15 04:00:00.000 -0800,691.1293355,60.2413112,63.89896774,-69919.76247,-67189.61563,14.9941073,69919.76247,67189.61563,4.098462044,3.93842999,18.9,27.8%
11/15/2025,2025-11-15 05:00:00.000 -0800,641.7851603,62.00840371,63.89896774,-36140.02197,-34829.61915,14.99428518,36140.02197,34829.61915,2.118406915,2.041595496,17.0,27.9%
11/15/2025,2025-11-15 06:00:00.000 -0800,723.9546641,60.20014445,63.89896774,-70706.70607,-67814.70327,14.99397397,70706.70607,67814.70327,4.144590039,3.975070531,19.0,27.8%
11/15/2025,2025-11-15 07:00:00.000 -0800,730.4526184,59.84893341,63.89896774,-77420.4563,-74225.42946,14.99394609,77420.4563,74225.42946,4.538127567,4.350845806,19.3,27.7%
11/15/2025,2025-11-15 08:00:00.000 -0800,655.2557927,58.66594963,63.89896774,-100034.3742,-96331.09157,14.99423922,100034.3742,96331.09157,5.863679615,5.646605602,20.6,27.7%
11/15/2025,2025-11-15 09:00:00.000 -0800,714.8670024,57.41958599,63.89896774,-123859.8616,-118857.4137,14.99401212,123859.8616,118857.4137,7.260249799,6.967023075,22.0,27.6%
11/15/2025,2025-11-15 10:00:00.000 -0800,693.1823598,58.16342163,63.74929428,-106779.5416,-102597.7509,14.99409932,106779.5416,102597.7509,6.259058709,6.013936162,21.0,27.7%
11/15/2025,2025-11-15 11:00:00.000 -0800,706.0237193,58.31981049,63.59962082,-100928.8543,-96902.9693,14.99404833,100928.8543,96902.9693,5.916111039,5.680127157,20.7,27.7%
11/15/2025,2025-11-15 12:00:00.000 -0800,741.1878998,57.62765706,63.70105209,-116099.0194,-111237.3703,14.99389894,116099.0194,111237.3703,6.805335251,6.520361684,21.5,27.6%
11/15/2025,2025-11-15 13:00:00.000 -0800,742.2956045,57.66109231,63.60336304,-113592.4472,-108828.652,14.99389399,113592.4472,108828.652,6.658408392,6.379170692,21.4,27.6%
11/15/2025,2025-11-15 14:00:00.000 -0800,675.1444249,57.97375584,63.60336304,-107615.5712,-103510.7095,14.99416782,107615.5712,103510.7095,6.308063965,6.067450733,21.1,27.7%
11/15/2025,2025-11-15 15:00:00.000 -0800,676.1434402,58.74400997,63.71237946,-94975.35106,-91347.27419,14.99416412,94975.35106,91347.27419,5.567136639,5.354470937,20.3,27.7%
11/15/2025,2025-11-15 16:00:00.000 -0800,739.4992808,57.59596195,63.90068054,-120521.0006,-115485.6789,14.99390645,120521.0006,115485.6789,7.064536961,6.769383289,21.8,27.6%
11/15/2025,2025-11-15 17:00:00.000 -0800,774.4269165,56.72083232,63.90068054,-137249.9787,-131244.8895,14.99374406,137249.9787,131244.8895,8.045133569,7.693135378,22.7,27.6%
11/15/2025,2025-11-15 18:00:00.000 -0800,763.0650696,56.52766253,63.90068054,-140942.6123,-134866.4324,14.99379853,140942.6123,134866.4324,8.26158337,7.905418077,22.9,27.6%
11/15/2025,2025-11-15 19:00:00.000 -0800,790.0419495,56.33468342,63.77039159,-142140.9974,-135796.5143,14.99366655,142140.9974,135796.5143,8.331828689,7.959936363,23.0,27.6%
11/15/2025,2025-11-15 20:00:00.000 -0800,800.7710673,55.85640011,63.60001373,-148026.918,-141329.9874,14.99361148,148026.918,141329.9874,8.676841621,8.284289998,23.3,27.5%
11/15/2025,2025-11-15 21:00:00.000 -0800,850.5824493,55.20066001,63.60001373,-160562.0458,-152846.1555,14.99333591,160562.0458,152846.1555,9.411608783,8.959329164,24.0,27.5%
11/15/2025,2025-11-15 22:00:00.000 -0800,838.064684,55.14016406,63.33125038,-156580.8062,-149166.9732,14.99340831,156580.8062,149166.9732,9.178241862,8.74366783,23.7,27.5%
11/15/2025,2025-11-15 23:00:00.000 -0800,864.9304321,54.82751745,63.30138779,-161986.5054,-154070.8524,14.99325027,161986.5054,154070.8524,9.495105829,9.03111679,24.0,27.5%
11/16/2025,2025-11-16 00:00:00.000 -0800,866.7975444,54.56330039,63.29144452,-166847.2033,-158676.4267,14.99323892,166847.2033,158676.4267,9.780023642,9.301080112,24.3,27.5%
11/16/2025,2025-11-16 01:00:00.000 -0800,822.8694997,54.35799039,63.0030899,-165259.7223,-157576.8305,14.99349333,165259.7223,157576.8305,9.686970826,9.236625468,24.2,27.5%
11/16/2025,2025-11-16 02:00:00.000 -0800,840.683253,54.04674365,62.71911983,-165781.1432,-157907.1641,14.99339334,165781.1432,157907.1641,9.717534772,9.255988515,24.2,27.5%
11/16/2025,2025-11-16 03:00:00.000 -0800,850.3236521,54.27974091,62.70417404,-161041.4638,-153304.8895,14.99333743,161041.4638,153304.8895,9.439710658,8.986218611,24.0,27.5%
11/16/2025,2025-11-16 04:00:00.000 -0800,827.473764,54.17036648,62.70417404,-163132.2654,-155505.8434,14.99346789,163132.2654,155505.8434,9.562266435,9.115231147,24.1,27.5%
11/16/2025,2025-11-16 05:00:00.000 -0800,833.6763041,54.09480769,62.46574936,-160018.921,-152481.9728,14.99343318,160018.921,152481.9728,9.379772625,8.937981993,23.9,27.5%
11/16/2025,2025-11-16 06:00:00.000 -0800,834.9518443,54.07118931,62.20303097,-155448.2852,-148115.4133,14.99342598,155448.2852,148115.4133,9.111857278,8.682028914,23.7,27.5%
11/16/2025,2025-11-16 07:00:00.000 -0800,765.2674713,55.49266567,62.10890579,-126476.0461,-121007.7973,14.9937881,126476.0461,121007.7973,7.413601766,7.093071355,22.1,27.6%
11/16/2025,2025-11-16 08:00:00.000 -0800,682.9400345,59.19273478,62.10890579,-55745.52503,-53594.62951,14.99413866,55745.52503,53594.62951,3.26761577,3.141537486,18.1,27.8%
11/16/2025,2025-11-16 09:00:00.000 -0800,614.1868179,61.29587104,62.10890579,-15541.97241,-15002.66877,14.99437349,15541.97241,15002.66877,0.9110183127,0.879406141,15.9,27.9%
11/16/2025,2025-11-16 10:00:00.000 -0800,620.3652705,60.97739563,62.36196938,-26467.51172,-25539.85494,14.99435439,26467.51172,25539.85494,1.551436795,1.497060665,16.5,27.9%
11/16/2025,2025-11-16 11:00:00.000 -0800,627.916716,59.55962461,62.64537277,-58987.1619,-56894.56162,14.99433053,58987.1619,56894.56162,3.457629654,3.334968442,18.3,27.8%
11/16/2025,2025-11-16 12:00:00.000 -0800,542.373349,62.00534871,62.74484634,-14136.23669,-13703.06618,14.99456856,14136.23669,13703.06618,0.8286187978,0.8032277949,15.8,28.0%
11/16/2025,2025-11-16 13:00:00.000 -0800,520.3024399,65.17258619,63.00346375,41464.94459,40246.05692,14.99461911,41464.94459,40246.05692,2.430536025,2.359088917,17.4,27.9%
11/16/2025,2025-11-16 14:00:00.000 -0800,520.3760854,63.21386382,63.00346375,4022.00779,3903.761651,14.99461895,4022.00779,3903.761651,0.2357566114,0.2288254192,15.2,28.0%
11/16/2025,2025-11-16 15:00:00.000 -0800,573.0479228,61.0449763,63.29129906,-42940.70586,-41550.47522,14.99449114,42940.70586,41550.47522,2.517040203,2.435549544,17.4,27.9%
11/16/2025,2025-11-16 16:00:00.000 -0800,592.6404012,59.85741393,63.59961319,-71535.88109,-69140.68034,14.99443714,71535.88109,69140.68034,4.193193499,4.052794862,19.0,27.8%
11/16/2025,2025-11-16 17:00:00.000 -0800,760.4580526,58.14082489,63.8185552,-108535.4925,-103872.4027,14.99381081,108535.4925,103872.4027,6.361986666,6.088651978,21.1,27.6%
11/16/2025,2025-11-16 18:00:00.000 -0800,781.7757334,57.35529874,63.89817047,-125073.536,-119549.273,14.99370797,125073.536,119549.273,7.331391324,7.007577548,22.0,27.6%
11/16/2025,2025-11-16 19:00:00.000 -0800,802.4176178,56.21926937,63.89817047,-146789.8734,-140135.2531,14.9936029,146789.8734,140135.2531,8.604330213,8.214258679,23.2,27.5%
11/16/2025,2025-11-16 20:00:00.000 -0800,792.0493622,56.19780788,63.89817047,-147200.1312,-140613.1386,14.99365636,147200.1312,140613.1386,8.628378148,8.242270724,23.2,27.5%
11/16/2025,2025-11-16 21:00:00.000 -0800,819.1833588,55.23475844,63.65485338,-160958.5348,-153509.125,14.99351348,160958.5348,153509.125,9.434849635,8.998190211,24.0,27.5%
11/16/2025,2025-11-16 22:00:00.000 -0800,813.3812897,55.37168382,63.50090027,-155398.1016,-148256.9769,14.99354485,155398.1016,148256.9769,9.108915688,8.690326897,23.7,27.5%
